sentence	BitsPerSample	durationMsec	speaker_gender	mother_tongue	audio
imusankwa usamide sikipa isiya siya uujisi ma headphone wakkala agwezyo lya mukaintu kabali mubbunga lya bantu 	16	9165	Female	toi	221230-132542_toi_b9a_elicit_9.wav
ulizyi ayebo kuti muntu katana anzyigwa amakwe 	16	3448	Male	toi	220829-205441_toi_0ae_elicit_23.wav
makulo ali mbuli ibbwe liyandika mumeso aayooyo uuajisi kufumbwa nkwajokela ulajana coolwe 	16	8870	Female	toi	221214-081355_toi_b9a_elicit_5.wav
kufwumbwa citikacitike mebo nsekanjili tee kuli maseseke ngosisa kuli cipati cilubide aamwi ziyakukubeda olikke 	16	15041	Female	toi	221228-100948_toi_b9a_elicit_29.wav
mukaintu uujisi kabbeke ka mubala uutuba wa nkwihyi kwihyi alimwi kajisi magilazi aabikidwe kusikipa wayaama kubwaanda 	16	10141	Female	toi	221213-091016_toi_b9a_elicit_20.wav
musilisi haatimba wakaamba kutu bakamubbida mali aasika kuzyuulu zyosanwe amyaanda yotatwe yamakwaca 	16	13204	Male	toi	220907-201714_toi_97d_elicit_24.wav
alimwi amootokala uusiya uudula kakuli mwaalumi umwi wayaama ansi kunze kwakwe 	16	7328	Female	toi	221212-093944_toi_b9a_elicit_4.wav
ulaba mbuli muntu uulala mukati kalwizi na mbuli muntu uulala akasamu kandembela 	16	15177	Male	toi	220916-181440_toi_97d_elicit_10.wav
mukaintu mutaanzi tayelede kuleka malekaleka nkaambo nguwaakumwaya busankwa 	16	5944	Male	toi	220829-113431_toi_0ae_elicit_2.wav
mukaintu ufulida acinwido cipya kapati kakuli ulikkele atebule kumabali akwendela 	16	10481	Female	toi	221207-165029_toi_b9a_elicit_22.wav
mwana wamwanike wakwe ambono zyabo zyoonse nzibakavubide abasing anda boonse 	16	9664	Female	toi	220904-192446_toi_0ae_elicit_46.wav
babwa bobilo uusiya a wa myuubi iisiyo balabalika mulubuwa 	16	8349	Female	toi	221212-085950_toi_b9a_elicit_21.wav
alimwi bakali kuto ngooka pesi bakali kulya kumwi 	16	4741	Female	toi	221204-133851_toi_ee8_elicit_16.wav
bantu bali cisambomwe baliimvwi mung anda yazitina zyasamende kakuli cipulasitiki acisuwo camubala wanyanzabili ansi 	16	10368	Female	toi	221214-095051_toi_b9a_elicit_5.wav
muntu uuongelezya mweenzinyina ulateya buzamba kumaulu aakwe muntu sizibi ulacegwa mumilandu yakwe 	16	15019	Male	toi	220916-164149_toi_97d_elicit_26.wav
ncicaanga bakati nanwaamba bbola nkoya kuli baamba 	16	4219	Male	toi	220825-180654_toi_0ae_elicit_18.wav
mpawo balanda basimbi abana babo bakaswena afwaafwi bakotama 	16	9846	Male	toi	221011-153723_toi_308_elicit_45.wav
kukubalika kutegwa ayenzye bulowa wakali kubalika ivoonse mu musumbuluko 	16	8326	Female	toi	221228-190233_toi_b9a_elicit_46.wav
mwaalumi uutonka pulemu yamwana kunkomwe mukaintu uula mwana musankwa kumpela 	16	8258	Female	toi	221212-132756_toi_b9a_elicit_11.wav
muntu uusamide kalukwe kabazapawida amabbusu aasiya ulikkede munsi munsi ankamu mpati yabantu 	16	9324	Female	toi	221213-093545_toi_b9a_elicit_6.wav
wakali kuunka kumilyango yabantu kuya kulomba cakulya 	16	4242	Female	toi	220907-085934_toi_707_elicit_28.wav
mwana musimbi a cisono cipentedwe cikambwe alimwi a mungungawaji mponya musyule tamulibonyi kabotu 	16	8938	Female	toi	221207-215437_toi_b9a_elicit_18.wav
aikudwaya uuzwa mumeenda alimwi walikweela amabwe 	16	5150	Female	toi	221212-120347_toi_b9a_elicit_24.wav
wakabweza impongo zili myanda yobile abagutu bali makumi obile imbelele zili myanda yobile abasijembwe bali makumi obile 	16	13340	Male	toi	221011-153723_toi_308_elicit_13.wav
bumwi buzuba twakaya musyokwe kukuvwira 	16	2790	Male	toi	220825-174423_toi_0ae_elicit_24.wav
nabwiinga uusamide delesi iituba ulizingulukidwe abeenzinyina basibwiinga abeenzyinyina banabwiinga basamide zisani zisiya 	16	11253	Female	toi	221213-090454_toi_b9a_elicit_14.wav
ncibakali kuyanda aboobo beelede kujosyelwa mali aabo 	16	5989	Female	toi	221228-144729_toi_b9a_elicit_13.wav
teeyakajana mpiikonzya kukalila amyeendo yayo aboobo yakapiluka kulinguwe mubwaato 	16	9801	Female	toi	220904-185526_toi_0ae_elicit_0.wav
mpawo juda wakaambila onani kuti unjilile mwanakazi wamukulana wako ucite mbweelede mulamu wako ukabusizye mukulana wako lunyungu 	16	16335	Male	toi	221011-174142_toi_308_elicit_0.wav
mukaintu mupati sikuzyana zyana uli mubusena aaciimo abana basimbi basyoonto 	16	8144	Female	toi	221213-094854_toi_b9a_elicit_21.wav
balo bana bacaale bakagama biyo kuya musyokwe mukuliseenya bacaale akusiya bukwazi muranda 	16	7282	Male	toi	220825-174423_toi_0ae_elicit_34.wav
nainvina uutapengede ukede biya ndi akumvwa kaambo 	16	3357	Male	toi	220825-180654_toi_0ae_elicit_33.wav
sikuma kaneti usamide cisani ca sikkaka ulikusotoka a kusola kuti aume kaneti 	16	7123	Female	toi	221210-182954_toi_b9a_elicit_0.wav
muntu buyo uujisi mulanda wabota kwiinda muntu uulipa kamikami pele wabula cakulya 	16	9642	Female	toi	221213-151941_toi_b9a_elicit_4.wav
wakalicenka mubili woonse acimbonimboni wakali acoolwe nkaambo mubili wakwe wakali wamibili 	16	9301	Female	toi	221228-185504_toi_b9a_elicit_21.wav
ooyu mukaintu wakati aa ino ncitenzi 	16	2563	Male	toi	220825-172540_toi_0ae_elicit_8.wav
kakulenga muntu wakapenga mumoyo wakwe nkabela jehova wakaamba kuti bantu 	16	8734	Female	toi	220904-182522_toi_0ae_elicit_15.wav
wakavwiila akumwitila mukati kumwi kapenuna bbuku lyaavwumbide katobolo akasando 	16	11684	Male	toi	220912-174208_toi_97d_elicit_27.wav
nibakajoka kuzyila kukulunduka nindakajalula ndakajana kwiimvwi bobilo 	16	9097	Male	toi	220907-201714_toi_97d_elicit_9.wav
nkabela enosi naakamana kupona myaka iili makumi aali musanu aane wakazyala kenani 	16	8802	Female	toi	221228-195818_toi_b9a_elicit_24.wav
mpoonya awo bana ba jakobo bakavwiila sekemu a hamori wisi cakweena nkaambo kakuti wakasofwaazya mucizi wabo dina 	16	16902	Male	toi	221011-160540_toi_308_elicit_27.wav
muntu omwe omwe uukwete ulayanda kuba abasune bakulimya ampwizi zyakukama 	16	11275	Female	toi	220912-145955_toi_707_elicit_17.wav
mwaalumi uimvwi munsi munsi a musena wakuyobolela myoota ugela busyu bwakwe kakuli mubwa wakwe walanga ansi munsi munsi amaulu aakwe 	16	12342	Female	toi	221212-122525_toi_b9a_elicit_12.wav
alimwi balanga kuli caalama ncamasimpe eco caalama hena bakabuzya bakaapanyina cakunyandwa 	16	8122	Female	toi	221228-100948_toi_b9a_elicit_18.wav
nkaambo walo ulaunka kuli haatimba kuya kumubuzya auti ncinzi cakali kucitika 	16	9052	Female	toi	221228-130305_toi_b9a_elicit_38.wav
kuli mwaalumi usotoka tulundu twamabwe kumabbililo aazuba 	16	5581	Female	toi	221207-150000_toi_b9a_elicit_5.wav
toonse biyo tuli bana bamuntu omwe tuli bantu baluleme balanda bako tabali basimutambatamba pe 	16	9369	Female	toi	221230-203112_toi_b9a_elicit_23.wav
ulanyonyoona munzi woonse nkaambo kakubula musanu wakati na ndajana mumo 	16	9483	Female	toi	220927-213329_toi_97d_elicit_38.wav
lino josefa wakaambila baku la na bakwe kuti mebo ndaamba kufwa pele leza ncobeni unoomuswaya akumupozya munyika ino 	16	11820	Female	toi	221230-144601_toi_b9a_elicit_31.wav
musankwa usamide chisani chisalala a kutuba wauma bbola mpati akati ka bantu banji 	16	6239	Female	toi	221207-182835_toi_b9a_elicit_43.wav
mwana ulakutondezya busyu bwabufubafuba a mulomo ujulikidwe kakkede a kalyumbo 	16	8326	Female	toi	221210-160825_toi_b9a_elicit_9.wav
na wakala kukulya amweendelezi yeeya kabotu cilyo ncowabikilwa lino utaingani na uli sindya 	16	17560	Male	toi	220916-174104_toi_97d_elicit_36.wav
wakafwubaala haatimba mbufwubafwuba mbookacita obuya wakatongooka haadunka 	16	7169	Female	toi	221228-145629_toi_b9a_elicit_25.wav
lino maanzi aamunkomo naakamaninina wakasowa mwana kunsi lyaciteu cimwi 	16	8507	Female	toi	220929-204510_toi_97d_elicit_17.wav
lino labani kali abana basimbi bobile izina lyamupati kali leya izina lyamwanike kali rakele 	16	9052	Female	toi	221229-142606_toi_b9a_elicit_24.wav
uli munyama aboobo bantu balaa myoyo yabunyama mbuki nduwe tabeelede kupona atalaanyika 	16	16357	Male	toi	220912-160501_toi_97d_elicit_3.wav
alo eci cilikasimpe nkaambo kumatalikilo aamwezi oyu kuli mazuba ali cisanu mwaatatu aajisi guwo linji alimwi amakumbi avumba izuba mane kusikila kukumana kwamazuba ayo 	16	20940	Female	toi	220903-234119_toi_707_elicit_47.wav
amane kumunywisya wakati ndatekela inkamele zyako azyalo 	16	5717	Female	toi	221228-202245_toi_b9a_elicit_37.wav
mwabula coolwe ba dakuungila baiaa mulimo mupati ngobacita 	16	9551	Male	toi	220912-160501_toi_97d_elicit_33.wav
bantu bobilo bafwusa mabbola manji akwaajata oonse ciindi comwe bajisi amunzenge basobanina mbunga yabantu bakkede amatantilo 	16	11343	Female	toi	221230-121748_toi_b9a_elicit_24.wav
musinsi uccovwa ncinga ujisi vwili lyomwe munsi munsi amuntu weenzya honda mumugwagwa wiinda bantu banji 	16	12682	Female	toi	221205-145546_toi_b9a_elicit_26.wav
imubwa wamabala mabala wasotoka mujulu kujata bbola yacisobano ca tennis kali mumuunda wabwizu bwizu 	16	9846	Female	toi	221230-124807_toi_b9a_elicit_12.wav
musimbi ujisi masusu aasubila ulimvwi anze alimwi ukanana amwalumi uusamide sikipa iitba alimwi amwaalumi umwi uula npanza 	16	11774	Female	toi	221212-122525_toi_b9a_elicit_15.wav
mwaalumi omwe ukkede usobanya kabbanjo kakuli umwi mwaalumi ulinvwi munsi mwa bbanjo mpati 	16	7600	Female	toi	221212-092637_toi_b9a_elicit_7.wav
ncibotu utani kulondi kamulya ali mulukuba 	16	3675	Male	toi	220829-121443_toi_0ae_elicit_28.wav
ciindi eciya farao naakakalalila balanda bakwe akutwaanga muntolongo mung anda yasilutwe wabatabilizi mebo amupati wabajisi 	16	19261	Male	toi	221011-181531_toi_308_elicit_2.wav
pesi sunu tujana kuti budima bwakafwa 	16	2563	Male	toi	220829-123454_toi_0ae_elicit_12.wav
na muntu wapilusya bubi mucibaka cabubotu bubi tabukooyoozwa mung anda yakwe 	16	9301	Female	toi	221214-081355_toi_b9a_elicit_10.wav
kufwa bamwi bakali kukolwa micelo 	16	1678	Male	toi	220829-121211_toi_0ae_elicit_2.wav
alimwi a cikambwe a kati ka nzila 	16	3720	Female	toi	221210-174315_toi_b9a_elicit_4.wav
kabunga kaba sikusobana zisobanyo kaima cakugalamana mumuunda kakuli nkamu yabantu kusyule 	16	8212	Female	toi	221212-145541_toi_b9a_elicit_9.wav
basimbi bosanwe amusankwa omwe basamide zyisani zyakuyaambya boonse kabayanda kusotokela muzyiba antoomwe 	16	11298	Female	toi	221205-142705_toi_b9a_elicit_30.wav
wence undiswiilile ndakupa mali aamuunda tambula kuzwa kumaanza aangu 	16	7373	Female	toi	221228-201041_toi_b9a_elicit_45.wav
bana bobilo bali mubulo kabajisi mabbuku ajisi zintu zisesya 	16	5966	Female	toi	221212-093156_toi_b9a_elicit_11.wav
ndaamba kufwa obu bupati bulandigwasyanzi elyo jakobo wakati taanguna kukonka 	16	8462	Female	toi	221230-114451_toi_b9a_elicit_0.wav
mulombwana ucita tiliki acinga mujulu 	16	3516	Female	toi	221213-111359_toi_b9a_elicit_6.wav
kukonka akati kesu swebo ayebo atutangane ayebo cizuminano kosyomezya kuti 	16	8349	Female	toi	221230-114451_toi_b9a_elicit_43.wav
ibbiza lisiya siya linunsya nunsya nsingo yamukaintu mbuli masusu aakwe mbwaaululuka 	16	7940	Female	toi	221207-145254_toi_b9a_elicit_6.wav
mukaintu mu pati usamide delesi li siya ulinwvi anze a mulyango kajisi cinkwa 	16	5422	Female	toi	221210-175557_toi_b9a_elicit_1.wav
abalo bakulana bakwe boonse wakabamyonta akulila alimbabo amane obo bakulana bakwe bakaambaula awe 	16	11162	Female	toi	221230-160247_toi_b9a_elicit_6.wav
ankwakkala sena akwalo ulikuzyi wakabuzya lwando 	16	7963	Female	toi	221228-151724_toi_b9a_elicit_27.wav
kuli babelesi banji a tefule lipati kapati kabali mu kabunga a kubika zyakulya a ma bbodela a manzi kaboneka alimwi a mukaintu usamide ma guluvu a kumanza a tupepa 	16	13884	Female	toi	221210-161339_toi_b9a_elicit_11.wav
bakeenda kwaciindi cilamfaa aumwi coyo kacicisa pesi kataryi cakunyemena 	16	9460	Female	toi	221228-150641_toi_b9a_elicit_45.wav
bakabona bana basimbi babantu kuti mbabotu nkabela bakakwata kufumbwa mbobakali 	16	9324	Female	toi	220904-182522_toi_0ae_elicit_9.wav
apanga lyamabekabeka ilyakali kuyumbana koonse koonse kusinkila inzila yamusamu wabuumi 	16	12069	Female	toi	221228-194723_toi_b9a_elicit_22.wav
babwa bako baya kudubulwa ntobolo kwainda mazuba otatwe alimwi biya tulijisi nguzu zyaku 	16	7486	Female	toi	221228-184203_toi_b9a_elicit_20.wav
mweenzu kutali kumilomo yako ibbwe ndidemu awalo musee ulalema pele bukali bwamufubafuba mbulemu kwiinda zyoonse 	16	20237	Male	toi	220912-191425_toi_97d_elicit_22.wav
uuvuzya imbono zyakwe kukujana impindu zyazikwelete ulaziyobweda sikufwida bacete luzyalo 	16	14883	Male	toi	220916-164149_toi_97d_elicit_1.wav
aawo mugwagwa wakausa kapati akubbwilimana anga watilamabele 	16	4605	Male	toi	220829-210823_toi_0ae_elicit_36.wav
nkaambo kakuti abrahamu wakaswiilila ijwi lyangu akubamba imbeta zyangu milazyo yangu indayo zyangu amulao wangu 	16	9369	Female	toi	221230-114451_toi_b9a_elicit_10.wav
butolo bulatola mung onzi impati mutolo ulafwa inzala uubamba mulao nguubamba buumi bwakwe 	16	8870	Female	toi	221214-082558_toi_b9a_elicit_14.wav
mubwa uutuba babwa bobilo basiya alimwi amubwa uusiya alimwi kuutuba balasobana kumbali kwa muunda wa bbola 	16	10504	Female	toi	221212-125046_toi_b9a_elicit_10.wav
musimbi usamide delesi lyacikambwe lyatudyombwi uleenda acitanda katasamide mabbusu 	16	7418	Female	toi	221230-122753_toi_b9a_elicit_20.wav
mwalumi usamide cisani ca cisombo ulakwenda kuya ku musilikali winvwi a kusotekela mugwagwa wabana maleya 	16	10685	Female	toi	221210-173747_toi_b9a_elicit_20.wav
haamwaandwe wakamubona mupulisa oyu mukamboni mboni kamootokala 	16	10118	Male	toi	220912-165131_toi_97d_elicit_30.wav
bantu bali cisambomwe bamyaka iindene balimvwi kumbele kwa bwaanda bupangidwe amabwe buvwumbidwe azyizikiziki 	16	11956	Female	toi	221212-124432_toi_b9a_elicit_16.wav
kufwumbwa kuti kanditasyomi muziyanza mbuli bwaceeci ncomusola kundaambila 	16	9755	Female	toi	221228-125403_toi_b9a_elicit_10.wav
mukaintu amwaalumi balaanze 	16	3198	Female	toi	221205-160542_toi_b9a_elicit_1.wav
zyoonse lino mwami wa sodoma wakaambila abramu kuti kondipa bantu pele imbono 	16	9619	Female	toi	220927-204620_toi_97d_elicit_34.wav
lemba lugwalo kumupati wako uubeleka 	16	3312	Female	toi	221205-183240_toi_ee8_elicit_44.wav
ulizyi usyi musimbi kuti tonookasalazigwa kkumi iyamyaka yayinda naakafwa mukaintu wako haatimba 	16	12251	Female	toi	221228-124509_toi_b9a_elicit_13.wav
bantu bakali biyo kwiinsauka kuzyana ng anda yoonse 	16	4424	Female	toi	221228-102126_toi_b9a_elicit_25.wav
muntu usamide cisani ca cikambwe cisiya kaji ambulela isalala uli a kuboneka mu nvula 	16	10232	Female	toi	221210-175557_toi_b9a_elicit_23.wav
mwaalumi uuli mubwato mumeenda ulanga kulubazu kwa kkamela 	16	5694	Female	toi	221212-145037_toi_b9a_elicit_11.wav
mubwa uula mabala mabala uutuba kuusiya alimwi kuusiya siya uleenda cakuselemuka mukazila musyookwe 	16	9710	Female	toi	221212-123748_toi_b9a_elicit_13.wav
omwe mukaintu uusamide delesi isyoonto iisiya alimwi acitambala camungunga waji 	16	6738	Female	toi	221213-085747_toi_b9a_elicit_10.wav
makakata alalesya kukazyanya alaandaanya basinguzu 	16	6148	Female	toi	221214-081355_toi_b9a_elicit_43.wav
kuti izina lyangu azina lyamatata abrahamu a izaka likalilile mulimbabo 	16	6715	Female	toi	221230-145947_toi_b9a_elicit_6.wav
bamvwe kamumuleka biyo kaya sena natija boobo amulandu watija 	16	5785	Male	toi	220829-115108_toi_0ae_elicit_30.wav
sikuccovwa nchinga wasotooka paipi ijisi kulambaikwa kakuli bantu balatamba 	16	7123	Female	toi	221213-095629_toi_b9a_elicit_0.wav
mane zyeemu ka zicimana kwibaiba mafuta baziburnba caba mukusu wacoondoonde 	16	10322	Female	toi	220903-202609_toi_707_elicit_17.wav
ino oyu muntu wakali kwaambanzi 	16	2200	Male	toi	220829-123454_toi_0ae_elicit_42.wav
cimwi ciindi kali mupati kale beenzinyina bakali kukunkulisya ndelema yameenda 	16	6102	Female	toi	220907-085934_toi_707_elicit_29.wav
nkuko nciceeco oyo munzi ncoambilwa kuti ngu zoari lino izuba nilyakamana kupata loti wakanjila mu zoari 	16	13136	Female	toi	221214-103945_toi_b9a_elicit_14.wav
mwalumi usamide zisani zili a penti ulakulemba kakkede a citishini 	16	6352	Female	toi	221210-144236_toi_b9a_elicit_14.wav
amulange ndafutuka akaambo kamwana ani mwana nindombyo mbotu 	16	3879	Male	toi	220825-172540_toi_0ae_elicit_17.wav
mwaalumi uusamide zyisani zyituba ulipetede maulu kukkala mumbali azyisuwo zyijisi cisyu mani ciindene indene kumusyika 	16	11003	Female	toi	221205-203343_toi_b9a_elicit_24.wav
sikukwaba bbola ujisi yunifoomu iisalala ulakunkulikila kumbele kwa ngoolo 	16	9347	Female	toi	221212-085950_toi_b9a_elicit_8.wav
moyo wakwe wakasukama dina mwana musimbi wa jakobo nkabela wakayandisya musimbi akumwaambila cakumoongelezya 	16	14656	Male	toi	221011-160540_toi_308_elicit_14.wav
kwakaceede biyo mwezi omwe kuti atumbuke kwategwa wakafwa nkaambo kakuti moyo wakayaswa cindi zigwebenga 	16	13022	Male	toi	220907-201714_toi_97d_elicit_26.wav
mwana musankwa ulabalika mucizyiba cameenda anze 	16	4560	Female	toi	221212-125046_toi_b9a_elicit_27.wav
wakazwa anze kumulyango wakajala mucibuye kunyina wakaliko haamwaandwe kabotu kabotu mbuli mangoye 	16	16221	Male	toi	220912-165131_toi_97d_elicit_15.wav
ameno aakwe ayootuba buu amalili zebuloni uyookala kunkomwe yalwizi uyooba inkomwe yamaato 	16	11434	Female	toi	221230-145947_toi_b9a_elicit_33.wav
mulombwana ulakwenda mubbuwa kakuli kuli bantu balindila mota musyule lyakwe 	16	7101	Female	toi	221210-150640_toi_b9a_elicit_25.wav
mubwa uutuba wasotoka mujulu kusoleka kujata bbola isubila 	16	5898	Female	toi	221205-213559_toi_b9a_elicit_14.wav
muntu ulazyana ambwe mpati munsi munsi abusena bujisi zisamu 	16	4787	Female	toi	221212-120347_toi_b9a_elicit_8.wav
amutume umwi wanu kuti akete mwanike wanu pele nywebo mulaangwa 	16	6783	Female	toi	221230-203112_toi_b9a_elicit_28.wav
alimwi mwalanga basimbi amatanga abantu mwauwika 	16	3267	Male	toi	220829-113431_toi_0ae_elicit_45.wav
mumeso aako utaindilili kuzwa kumulanda wako kuletwe twaanzi mukasambe kuma ulu 	16	11502	Female	toi	220927-213329_toi_97d_elicit_0.wav
tuli babunyina bali ikumi ababili bana bamuntu omwe umwi taciwo amuniini wasyaala kuliwiseesu munyika ya kanana 	16	10005	Female	toi	221230-203112_toi_b9a_elicit_48.wav
aabili amyaka iili musanu aibili elyo wakafwa 	16	6897	Female	toi	220904-182522_toi_0ae_elicit_5.wav
mpawo juda wakaswena afwaafwi kulinguwe wati wence simalelaangu ndemulanda wako nyambe ijwi mumatwi aasimalelaangu 	16	12069	Female	toi	221230-161409_toi_b9a_elicit_20.wav
nindamwaambila wakavwila caalama ajwi litete alimwi ndimuzyibizyizye limwi kufwumbwa nomwaamba nzyomutiambe anguwe 	16	12342	Female	toi	221228-100948_toi_b9a_elicit_23.wav
bona myaka iili makumi obile ndakakala kulinduwe imbelele zyako ampongo zyako tazikwe nizyakasowa 	16	14860	Male	toi	221011-123458_toi_308_elicit_14.wav
wapiluka kubeenzinyina wati mwana taciwo lino mebo njiinke kuli 	16	6783	Male	toi	221011-170850_toi_308_elicit_34.wav
mulombwana uutasamide sikipa pepe kasamide bulukwe busiya ulasobana acisobanyo camavwili 	16	7917	Female	toi	221212-094543_toi_b9a_elicit_1.wav
mupati wamapulisa wakajana mubelesi wa haatimba ulaangilidwe amupando mung anda yakwe 	16	11502	Male	toi	220907-201714_toi_97d_elicit_6.wav
pe basa kamuya biyo munywe nkanywe cibwantu biya 	16	3289	Male	toi	220825-174423_toi_0ae_elicit_28.wav
mwaalumi ufwugeme ansi kubeleka mulimo mupati kali biyo alikke 	16	5490	Female	toi	221230-123721_toi_b9a_elicit_15.wav
bana bobilo baimikila a tefule kabalanga ca kulya ca bikwa 	16	4696	Female	toi	221210-172122_toi_b9a_elicit_49.wav
ndime wanu sikwaazwa haamwaandwe mbwaakamanina biyo kulemba wakamvwa ukonkomona acijazyo 	16	13385	Male	toi	220912-174208_toi_97d_elicit_26.wav
uyooenda abula bwako abulongo buyooba zilyo zyako mazuba oonse aabuponi bwako 	16	7600	Female	toi	221228-194723_toi_b9a_elicit_5.wav
muntu uucenjede ulacita caluzibo pele mufubafuba ulamwayaula kupilingana kwakwe 	16	9165	Female	toi	221213-153046_toi_b9a_elicit_40.wav
mpawo jakobo wakaambila simeoni a levi kuti mwandifwabya nkaambo mwandinunsya akati kabantu bakede munyika ba kanana aba perizi mebo tuli bace buyo 	16	20849	Male	toi	221011-160540_toi_308_elicit_48.wav
kumyaka iili myanda iili musanu aitatu alimwi wakazyala bana balombe abasimbi 	16	7781	Female	toi	221228-200327_toi_b9a_elicit_11.wav
wakapandulula kumapulisa mbuli bantu aba mbobakabambidwe anzyobakasamide 	16	7418	Male	toi	220907-201714_toi_97d_elicit_19.wav
mukwasyi utamba kana kasimbi kafwulida ma nkendulu akkekke lyakwe lya buzuba bwakazyalwa 	16	10277	Female	toi	221213-093545_toi_b9a_elicit_24.wav
ndiyanda kukujaya nkaambo kakunyonganya kumisya akujaya caalama 	16	10005	Male	toi	220912-160501_toi_97d_elicit_6.wav
musankwa mukubusyi ulaa masusu malemu asubila wabikka mulongo wamabbola aakwe ali fwuka atabule lisobaninwa cisobano ca pool 	16	11048	Female	toi	221205-164321_toi_b9a_elicit_16.wav
imane yakamwaambila kuti lyoonse amana biyo mapopwe inga koboola mpamunya ano unakundijana 	16	6942	Male	toi	220829-121443_toi_0ae_elicit_18.wav
nyika yoonse ya egepita ili kunembo lyako kazika uso abakulana bako mububotu bwanyika bakale munyika ya goseni 	16	12047	Female	toi	221230-160247_toi_b9a_elicit_48.wav
simweembela ng ombe ulijisilidi mbuli bbiza iitatambisidwe mboisoleka kumusowela ansi kumwi bantu kabalangilizya 	16	10821	Female	toi	221207-144416_toi_b9a_elicit_0.wav
uuyandisya misobano uyooba mucete uuyandisya waini amafuta takooyooba muvubi pe 	16	8870	Female	toi	221214-084847_toi_b9a_elicit_21.wav
elyo izaka wakazanga wafwa wainka kulibasinsiku bakwe naakacembaala bucembele buzwide nkabela esau a jakobo bana bakwe bakamuzika 	16	20781	Male	toi	221011-163041_toi_308_elicit_34.wav
tanaakali kumusabila mukubala kwakwe taku naakali kukanana kuli nguwe 	16	7260	Female	toi	221228-180049_toi_b9a_elicit_26.wav
wakamvwa mbokabelesegwa kaambyo aka 	16	2291	Male	toi	220829-115108_toi_0ae_elicit_3.wav
ono kuti koyile kubbulyaika olike mumigwagwa mipati cindi camasiku bumwi buzuba mbotakwe coolwe uya kuyaanya nkamu yamasoosi bakakujaye akukutolela zyoonse nayojisi 	16	12909	Male	toi	220825-172540_toi_0ae_elicit_32.wav
bamaalumi bobilo bajika cimwi cintu amulilo mukagabba musyokwe 	16	7623	Female	toi	221205-153008_toi_b9a_elicit_24.wav
limwi umwi wamuli ndinywe wakopwa kaindi ulizyi avebo kuti kuli bamwi 	16	6465	Male	toi	220829-113431_toi_0ae_elicit_47.wav
mbombuboobo mbokabelesegwa kaambyo aka 	16	2336	Male	toi	220829-123454_toi_0ae_elicit_33.wav
mwaalumi uusamide cisani camubala wacikambwe wa mungunga waji alimwi akasoti kakudwaya ka nyanzabili uusamide magilazi mapati alimwi uladwaya 	16	11071	Female	toi	221212-132756_toi_b9a_elicit_16.wav
kana kasimbi kalazekaula aa mesulu yamungunga waji uulisamide a lutambo lwamu zyuuno zyamumoota 	16	9687	Female	toi	221212-123117_toi_b9a_elicit_15.wav
wakabweza cifwanikiso akucimatika kukkabati amane wakasosoloka waakuyaama kubwaanda akutondezya 	16	14724	Male	toi	220907-201714_toi_97d_elicit_45.wav
lino kakuli inzala muzisi zyoonse pele munyika yoonse ya egepita kakuli zilyo 	16	5331	Female	toi	221230-203112_toi_b9a_elicit_5.wav
musankwa usamide cibbudula cacikambwe ulasotooka sotooka abulo 	16	5104	Female	toi	221230-120719_toi_b9a_elicit_45.wav
makani manji manji akakakananwa pele kwakalangika kuti nondo tanaakali kuteelela caka iikwaambwa 	16	7917	Female	toi	220906-211510_toi_707_elicit_11.wav
bana botatwe basamide mayunifoomu abasikusobana cisobano cabbola balundukila bbola yamabala aacikambwe acisikili 	16	8757	Female	toi	221212-131327_toi_b9a_elicit_1.wav
syacaaba ulajana coolwe nkaambo ulaabana zilyo zyakwe abatengwana 	16	10073	Male	toi	220916-174104_toi_97d_elicit_19.wav
zyabantu aba mbendakaya abo nkokuti aneri a esikoli a mamre batole zyaabilo zyabo 	16	12954	Female	toi	220927-204620_toi_97d_elicit_39.wav
musankwa uudukumene alimwi katambaika maanza ulimukati mwa hwili 	16	7464	Female	toi	221210-184158_toi_b9a_elicit_15.wav
sikudwaya wajata mayuwe amulwizyi alimwi usola kulidonsa 	16	5490	Female	toi	221212-151620_toi_b9a_elicit_9.wav
sikwiimba musankwa uujisi masusu malanfwu ulasobana a piyano 	16	5762	Female	toi	221213-083400_toi_b9a_elicit_10.wav
lino kwakaba inzala munyika nkukuti inzala imbi iteensi intaanzi yamumazuba aa abrahamu nkabela izaka wakainka kuli abimeleki mwami waba filisti ku gerari 	16	14701	Female	toi	221230-114451_toi_b9a_elicit_4.wav
chifotolo chamunsi chitondezya mwalumi ujisi susu lilamfu ulakuma banjo lya magesi lisalala 	16	8643	Female	toi	221207-211353_toi_b9a_elicit_13.wav
nkaabona kaligwa ulabona kamwi walya kamwi nkuvwunga mumulembo nkutolela bana kunanda 	16	7623	Male	toi	220824-212101_toi_0ae_elicit_32.wav
nkabela bantu ibakali kumulyango wang anda baniini abapati boonse buyo 	16	7554	Female	toi	220929-200958_toi_97d_elicit_16.wav
mubwa uusiya amubwa wamungungawaji baleenda mubwizu 	16	4469	Female	toi	221213-093545_toi_b9a_elicit_10.wav
na cisi cabisya cilijisi beendelezi banji pele mumaanza aabantu basongo abasiluzibo cilakalilila 	16	9664	Female	toi	221214-095919_toi_b9a_elicit_33.wav
pele twakaamwaambila kuti ne tuli bantu baluleme tatuli basimutambatamba pe 	16	8326	Female	toi	221230-203112_toi_b9a_elicit_47.wav
inzila yabasizibi ili mbuli mudima uusia mbi tabezi kuli butezi mwanaangu swiilila majwi aangu 	16	11434	Female	toi	221213-115557_toi_b9a_elicit_14.wav
mpoonya waya utuntaila biya kuya kumunzi 	16	2767	Male	toi	220829-121443_toi_0ae_elicit_41.wav
haamwaandwe wakanjizya mootokala wakwe mulukwakwa iwang anda yokwa lwando akuya kuuimika munsi munsi 	16	12568	Male	toi	220907-203915_toi_97d_elicit_2.wav
kuciindi cakusekelela bantu bajisi zyizo zyikozyenye boonana mucisi ca asia bamwi bantu balajatilila dembela mujulu kutondezya lugwasyilizyo kuli mbabo 	16	12614	Female	toi	221230-132542_toi_b9a_elicit_10.wav
mudala uusamide nzyeete yabasing ombe alimwi abulukwe bwa jiini bwacikambwe utandaanya mbelele amwana kulubazu lumwi 	16	9483	Female	toi	221213-091726_toi_b9a_elicit_14.wav
pele webo wakaamba kuti ncobeni njookubamba kabotu akuvuzya lunyungu lwako lube 	16	9075	Male	toi	221011-153723_toi_308_elicit_10.wav
kumwi kalijatilila mumatwi akaambo kakucisa nkombo wakamukwasula iwakunze mweenzinyina 	16	9097	Female	toi	221228-175149_toi_b9a_elicit_44.wav
