sentence	BitsPerSample	durationMsec	speaker_gender	mother_tongue	audio
nkabela mazuba aabuumi bwa izaka akasika kumwanda amakumi aali musanu aatatu 	16	11321	Male	toi	221011-163041_toi_308_elicit_33.wav
bukali bulayoosya lunyemo lulakataazya pele ibbivwe ngwani uukonzya kwiima kulindilyo 	16	9006	Female	toi	221214-095919_toi_b9a_elicit_12.wav
mwana musankwa utola lubazu mukutondezya zyintu 	16	5603	Female	toi	221205-204405_toi_b9a_elicit_7.wav
aasalala 	16	2019	Female	toi	220929-202615_toi_97d_elicit_21.wav
babo banamalelo akaambo kamukaintu mupya 	16	4015	Male	toi	220829-123454_toi_0ae_elicit_30.wav
mu nineteen seventy two ndakazyi kutalika kumvwa twaambo tunjitunji anguwe 	16	6783	Female	toi	221228-131959_toi_b9a_elicit_12.wav
mwaalumi uusamide zisani zisyoonto ulasotooka ancinga iisubila 	16	4719	Female	toi	221212-125952_toi_b9a_elicit_1.wav
mwana musankwa uuboneka mbuti ula myaka fwuka na kkumi uzela nswi mukalonga 	16	8167	Female	toi	221213-095629_toi_b9a_elicit_26.wav
uusampaula mweenzinyina ngusizibi pele uli acoolwe uufwida bacete luzyalo 	16	8507	Female	toi	221213-153842_toi_b9a_elicit_18.wav
mutengwana uupenzya mucetenyina uli mbuli imvula yamucobocobo litapi zilyo 	16	9778	Female	toi	221214-095919_toi_b9a_elicit_34.wav
nkabela yakajwa pepe lyomwe yakabika mucisuwo 	16	4741	Male	toi	220829-121443_toi_0ae_elicit_16.wav
elyo kaini wakaswanana amukaakwe nkabela wakaminta wazyala enoki alimwi 	16	7532	Female	toi	221228-194723_toi_b9a_elicit_45.wav
mulombwana uujisi sikipa iituba amukaintu uusamide delesi baleenda cakuselemuka mumugwagwa wabulongo antoomwe kabajatene maanza 	16	10572	Female	toi	221213-103711_toi_b9a_elicit_15.wav
muusimbi ulaa masusu malamfwu asiys siya avwumbide vwumbide kumeso ubikkide kuboko acamba 	16	9188	Female	toi	221205-204405_toi_b9a_elicit_1.wav
babungike zilyo zyoonse zyamyaka eyi mibotu iiti sike balondole maila mumaanza aa farao kuti kube zilyo muminzi babike kumbali 	16	11956	Male	toi	221011-181531_toi_308_elicit_30.wav
muuwo wakunyika ulaleta imvula lulimi luvwiya lulaleta busyu bukali kukala acooko calululi lwang anda nkubotu 	16	20078	Male	toi	220916-181440_toi_97d_elicit_34.wav
mubwa mupati ulabalika mubwizu kajisi ntambo kumulomo 	16	4265	Female	toi	221212-092637_toi_b9a_elicit_0.wav
bana a ba manyina balikkede mumbali a kana kasimbi kasamide cisani ca nkwiki nkwiki kainvwi 	16	7214	Female	toi	221210-175557_toi_b9a_elicit_17.wav
wakaleta mulandu mupati but kumwami kalenganzubo ncaatakali kumana mapena kuli neuwe 	16	11752	Female	toi	221228-180049_toi_b9a_elicit_35.wav
wakayandaula pepa lyakulembela mpaakali kulemba lugwalo akutalika nomuyandwa nobabetesi 	16	14520	Male	toi	220912-174208_toi_97d_elicit_6.wav
basimbi bobilo balikkede mumabazu aayindene atebule yazintu zyakubamba bamba amabbuku 	16	6602	Female	toi	221212-130445_toi_b9a_elicit_18.wav
muntu utanta mulundu mulamfwu uupapalete kumwi kajilisidi ntambo yakulikwabilizya 	16	8144	Female	toi	221230-123721_toi_b9a_elicit_47.wav
ngu hidekeli ngonguwo uutola kujwe ku asuri amulonga wane ngu firate lino jehova 	16	9710	Female	toi	221228-193637_toi_b9a_elicit_17.wav
nkaambo mulinguwo mobuzwa buumi sowa majwi aapilingene kwaamba kutaluleme kube kule kulinduwe 	16	8757	Female	toi	221213-115557_toi_b9a_elicit_17.wav
bantu bobilo balabeleka omwe ulapima mpoona umbi ulalangilizya 	16	7759	Female	toi	221205-160542_toi_b9a_elicit_7.wav
wakati ndime leza leza wauso utayoowi kwiinka ku egepita nkaambo njoocita kuti ukabe musyobo mupati nkuko 	16	8689	Female	toi	221230-160247_toi_b9a_elicit_24.wav
liya nobwau mbulala busiku mwayeeya musinzo pesi nokuba inga 	16	4877	Male	toi	220829-113431_toi_0ae_elicit_44.wav
banyina mubekwabekwa mbobakali kucita kuti mubekwabekwa katakwe bulemu 	16	5172	Female	toi	221205-183240_toi_ee8_elicit_9.wav
bana bobile balakusobana a moota wakusobanisya munzila a muntu mupati omwe 	16	7532	Female	toi	221207-211353_toi_b9a_elicit_14.wav
akukasibika kuti bazikufume kulisya bana buntu 	16	2881	Male	toi	220829-121443_toi_0ae_elicit_44.wav
aboobo josefa wakali kuya bweendeenda munyika yoonse ya egepita 	16	6624	Male	toi	221011-181531_toi_308_elicit_44.wav
nkabela kusi wakazyala nimrodi ngonguwe iwakataanguna kuba mwaalumi sintaze ansi 	16	10958	Female	toi	220904-192446_toi_0ae_elicit_19.wav
mbuli kaaka tunji tunji bakabelesya liciswa mwana 	16	5059	Male	toi	220824-212101_toi_0ae_elicit_3.wav
mwaalumi amukaintu basasamide basyaamankwamubakumbatana kupobwe yaanze 	16	7940	Female	toi	221212-151620_toi_b9a_elicit_2.wav
mukaintu uusiya ulanganya mwana uusunila uusobana mukagoti kazwide tubbola twa pulasitiki 	16	8734	Female	toi	221213-100518_toi_b9a_elicit_17.wav
alimwi wakamusamika zyakusama zyabuluba akubika munkonde wangolida munsingo yakwe 	16	12342	Male	toi	221011-181531_toi_308_elicit_38.wav
mwanamusyoonto amukubusyi baosedwe masusu balikkede a cuuno 	16	7577	Female	toi	221205-124826_toi_b9a_elicit_12.wav
mucibona aakale bakombwe banji balwana okuno nkoamba boobo ndayeeya cindi nindakacili mwana 	16	11071	Female	toi	221228-093456_toi_b9a_elicit_45.wav
mpawo kwakasika mulobosi walwiida abramu mu hebrayo iwakakede kumibanga 	16	9914	Female	toi	220927-204620_toi_97d_elicit_20.wav
israyeli kayandisya josefa kwiinda bana bakwe boonse nkaambo kali mwana wabucembele bwakwe nkabela wakamucitila ijansi lili amaboko 	16	16108	Male	toi	221011-163041_toi_308_elicit_49.wav
pal nyama yananga itontola siko nakarmila zeeze 	16	5626	Female	toi	221214-101722_toi_b9a_elicit_14.wav
mwaalumi uusamide jansi iisiya bulukwe anzyeete iikasaala alimwi kali amwana aakwe musimbi bala sobana mpobasowela dooti 	16	11343	Female	toi	221212-124432_toi_b9a_elicit_8.wav
nkamu yabantu baimvwi kunze kwa mootokala mucisi 	16	5150	Female	toi	221213-085747_toi_b9a_elicit_24.wav
cidada cipati ciyuunya mababa mbuli mbocizwa mumeenda 	16	5422	Female	toi	221212-125046_toi_b9a_elicit_41.wav
wakaa kukkala acuuno ciseyamwa akutalika kuyeeya haadunka 	16	7486	Female	toi	221228-130305_toi_b9a_elicit_9.wav
musimbi uusamide bbikkini uleenda kumnkomwe kuli museenga mpoona amakumbi alalibonya 	16	7713	Female	toi	221207-150000_toi_b9a_elicit_9.wav
nkaambo tatuzyi kabotu lyoonse mbotuteende 	16	2699	Male	toi	220825-180654_toi_0ae_elicit_8.wav
mbwaakasikila kung anda yakwe wakaindilila kutila tukoko munkomeki 	16	6851	Female	toi	221228-162240_toi_b9a_elicit_31.wav
balatongooka kapati kukaambo kakuti nsesalede 	16	4945	Female	toi	221228-181007_toi_b9a_elicit_34.wav
alimwi atutangane buzwalani bwalukwatano kuti mutupe bana banu basimbi anywebo mutole bana besu basimbi 	16	14179	Male	toi	221011-160540_toi_308_elicit_23.wav
aalo meso aamuntu taakuti cuumpilo ncansiliva ceengelo ncangolida pele muntu ulasunkwa kumpuwo yakwe 	16	19896	Male	toi	220912-191425_toi_97d_elicit_38.wav
nkaambo mupati wakwe wakafwa lino wasyaala alike na wasikilwa bubi mulweendo ndomutola muyooselusya imvwi zyangu cabuusu mukabanda 	16	12659	Female	toi	221230-204223_toi_b9a_elicit_6.wav
lwando wakapukunya biyo mutwe mumoyo wakali 	16	3675	Female	toi	221228-104522_toi_b9a_elicit_44.wav
ino baya kundikwanga baya kubona baya kundilisya bula bwasulwe kuti batakapandululi kabotu 	16	11865	Female	toi	221228-104522_toi_b9a_elicit_3.wav
koula busongo alulayo abupampu wisi mululami ulasekelela loko uuzyala musongo ulajana kukondwa mulinguwe 	16	12931	Female	toi	221214-090248_toi_b9a_elicit_24.wav
mukaintu uusiya amukaintu mukuwa kusanganya abamakuwa basankwa botatwe basamide zyisiya kabali kumbele amatantilong anda mpoona bantu banji balikkede 	16	14202	Female	toi	221205-142705_toi_b9a_elicit_24.wav
kabunga ka ba malumi bo tatwe bonse kabasamide ma jiini balakwenda mukazila 	16	6307	Female	toi	221210-142024_toi_b9a_elicit_6.wav
bakanjila mumootokala ookwa haatimba balupa maulu bamadaala yatuba ilya kumaanda aabo 	16	9097	Female	toi	221228-183113_toi_b9a_elicit_28.wav
mbunga yabantu bali invwi mumulaini a mumbali a bwanda 	16	5331	Female	toi	221210-174855_toi_b9a_elicit_18.wav
haamwaandwe wakaywiila caalama toyelede kundibuzya twaambo tuli mbuli bwakaako 	16	11003	Female	toi	221228-162240_toi_b9a_elicit_16.wav
musankwa ulakusola kusola kufuzilila ci bbaluni kubesha ci ling i ca nsimbi ci pati 	16	9596	Female	toi	221210-153407_toi_b9a_elicit_2.wav
elyo batumwa bakaboola kuli jakobo bati twakasika kumukulana wako esau 	16	6420	Male	toi	221011-153723_toi_308_elicit_0.wav
mulombwana sikudwaya usamide sikipa yamungunga waji uli mumayuwe muzyiba abboodi yakwe iituba 	16	8961	Female	toi	221213-100518_toi_b9a_elicit_9.wav
nkaambo kakuti bakacili kusyibingana tibakali kuyanda kufwambaana kwaanjila makani aaya 	16	9415	Female	toi	221228-094635_toi_b9a_elicit_27.wav
akale inga umwi kaya kutozya kajinjinji kuwa bakakkala zyuuno zyamipando haamwaandwe 	16	10799	Female	toi	221228-151724_toi_b9a_elicit_10.wav
nkaambo mubukali bwabo bakajaya muntu amukunyema kwabo bakatyola musune 	16	7350	Female	toi	221230-145947_toi_b9a_elicit_24.wav
taku mpomwindene adyabulosi wakacenga ba adamu a yeva kumalengelo ulimvwide ociyanga webo 	16	10753	Male	toi	220907-203915_toi_97d_elicit_28.wav
nsikwe nendakabona ing ombe zibi zili boobu munyika yoonse ya egepita 	16	8212	Male	toi	221011-181531_toi_308_elicit_13.wav
bana bakati baama tabawo pe baitilwa bulwazi bwamwana 	16	4628	Male	toi	220825-174423_toi_0ae_elicit_41.wav
nibwakaca bakabuka elyo wakati amundisungule kuya kulisimalelaangu 	16	7736	Female	toi	221228-203310_toi_b9a_elicit_46.wav
sicuuno wakati muzovu banyama boonse bakali kumuyoowa 	16	4015	Female	toi	220906-211510_toi_707_elicit_16.wav
cakali kwiile kubee ncaano mbuli caba mwaaba a sulwe pesi kacili masimpe a nguni unga tasyomi 	16	8870	Female	toi	221228-185504_toi_b9a_elicit_11.wav
simeso asiya siya usamide magogo alimwi a juzi li tuba kajisi a kana kakwe kaniini kasimbi kalamasusu abaluka baluka 	16	11253	Female	toi	221207-171156_toi_b9a_elicit_19.wav
bamalumi banji banji balakulangilizya cimwi cintu amupanda 	16	5059	Female	toi	221207-173408_toi_b9a_elicit_13.wav
ciindi ncibakali kuswayana cakali ciindi camasikati 	16	4492	Female	toi	220906-213431_toi_707_elicit_17.wav
cuuno cakwe cilaimikwa nji mubululami utalilemeki kubusyu bwamwami nekuba kwiima mubusena bwabalemu 	16	16425	Male	toi	220916-181440_toi_97d_elicit_17.wav
mukaintu uula masusu aatuba tuba ulilede mubwizu 	16	4378	Female	toi	221213-091726_toi_b9a_elicit_26.wav
uuvuzya imbono zyakwe kukujana impindu zyazikwelete ulaziyobweda sikufwida bacete luzyalo 	16	9075	Female	toi	221214-095919_toi_b9a_elicit_39.wav
mpoonya awo bakanywisya wisaabo waini masiku ayo ngaonya nkabela mupati wakasika 	16	9823	Female	toi	220929-202615_toi_97d_elicit_0.wav
lino wakanjila mwaakabede wisi wati taata wakavuwa kuti mpondi 	16	7260	Female	toi	221230-113547_toi_b9a_elicit_24.wav
bakamuvwiila kuti mulanda wako wiseesu uli kabotu ucipona elyo bakasintama bakotama 	16	7441	Female	toi	221230-204223_toi_b9a_elicit_40.wav
jatisya milazyo yangu kuti upone mulao wangu ube mbuli imboni yaliso lyako 	16	7917	Female	toi	221213-122458_toi_b9a_elicit_2.wav
mubwa wamungunga waji uusamide nketani yacikambwe iila zyina ula bbulungana mumunda wabwizu 	16	8507	Female	toi	221213-103711_toi_b9a_elicit_1.wav
aboobo ndini kuli aazinji zyakulibambila sunu kumazuba ajunza 	16	8349	Female	toi	221228-125403_toi_b9a_elicit_48.wav
ikabunga kabantu baimvwi mulongo kumbele asambalilwa zyintu mucintoolo 	16	6919	Female	toi	221205-210659_toi_b9a_elicit_8.wav
cibeela cabili zyamumabbuku 	16	3312	Female	toi	221205-183240_toi_ee8_elicit_49.wav
mbuli kayuni kapembelela na mbuli sikamembya mukuuluka kwakwe mbulubede lutuko lwabuyo talusiki pe 	16	17492	Male	toi	220916-181440_toi_97d_elicit_40.wav
kunembo lya mamre muunda abrahamu ngwaakaula kuli efroni mu hi ti kuti auvube ube mavwikilo 	16	10753	Female	toi	221230-144601_toi_b9a_elicit_18.wav
lino kaini wakaambila munyina abelo kuti atweende musokwe nkabela nebakali 	16	9301	Female	toi	221228-194723_toi_b9a_elicit_31.wav
amane wakabbatika lugwalo ndwaakali kulemba acamba cokwa mutelampondo 	16	7101	Female	toi	221228-190711_toi_b9a_elicit_8.wav
aboobo cipo cakatumwa kunembo pele walo mwini wakoona masiku ayo mpoonya awo amalabba 	16	3471	Male	toi	221011-153723_toi_308_elicit_22.wav
elyo baya balavwuwa ajwi tete balalikombelela akwaamba kuti 	16	4287	Male	toi	220825-174423_toi_0ae_elicit_15.wav
lino ngwani uuzi lunyonyooko ndubakonzya kuleta atusimpi tumwi twabasongo ntootu 	16	9415	Female	toi	221214-091851_toi_b9a_elicit_5.wav
mwalumi usamide chisani ca sikkaka ulakubeleka musule a tefule lyakusambalila kumusika wa baswi 	16	10481	Female	toi	221207-213049_toi_b9a_elicit_15.wav
nkamu yabantu batamba cintu cimwi kabakwiila alimwi akubweza zifwanikiso 	16	7441	Female	toi	221212-095755_toi_b9a_elicit_17.wav
misukulu ya esau lino njeeyi mizukulu ya esau ngonguwe edomu 	16	9982	Male	toi	221011-163041_toi_308_elicit_35.wav
mwana musimbi ulasonya cidooli akasena kamaanzi 	16	5240	Female	toi	221230-121748_toi_b9a_elicit_37.wav
bamakaintu botatwe basamide zisani zyamapobwe zyamabala mabala balazyanza ane mulubuwa 	16	9211	Female	toi	221212-131327_toi_b9a_elicit_36.wav
ino kuti wafwa olaa mulandu 	16	1542	Male	toi	220829-115108_toi_0ae_elicit_43.wav
mwana musankwa ulakumweta ka tapula menda a kukkala mukati a zintu zyakuyambila zi salala a zya cikambwe 	16	7827	Female	toi	221210-173239_toi_b9a_elicit_6.wav
ndime leza singuzuzyoonse zyalisya ukavule mulinduwe mulazwa musyobo ankamu yamisyobo amucikungu cako muyoozwa bami 	16	18127	Male	toi	221011-163041_toi_308_elicit_14.wav
naakasika musyokwe wakali kuuma zisamu 	16	2359	Male	toi	220829-121211_toi_0ae_elicit_4.wav
musankwa unenede uli a kutijana kuzyunguluka a bwizu musule a ma dangamwa 	16	6193	Female	toi	221210-175557_toi_b9a_elicit_0.wav
ciindi cakubuka zilakwaambauzya 	16	3040	Female	toi	221213-121824_toi_b9a_elicit_14.wav
amane waluba wide kuti ambeyo ndaluba ani mebo kali mumoyo 	16	4514	Male	toi	220825-174423_toi_0ae_elicit_7.wav
mwana musankwa watozya busyu kuwa mubwizu naalikusobana bbola yamaulu 	16	7940	Female	toi	221205-204405_toi_b9a_elicit_15.wav
ulakonzya kusotoka kumwiinda muntu oolu luwaya wakatondeka luwaya iwaazingulukide lubuwa 	16	10027	Female	toi	221228-145629_toi_b9a_elicit_4.wav
mpoonya awo bakabopa imbongolo zyabo amaila bainka pele kucile umwi wabo wakajula inkomo yakwe 	16	10867	Female	toi	221230-203112_toi_b9a_elicit_41.wav
naakamana kuumputwa bbodela lyabukoko mumutwe kalinda wakaa kusyonka mulomo ansi ndwajilo 	16	9165	Female	toi	221228-180049_toi_b9a_elicit_12.wav
ncitutangene anyika kuyooba kuti na ndabusya ijoba ajulu lyanyika fulicoongo wangu 	16	12024	Female	toi	220904-190848_toi_0ae_elicit_42.wav
mwaalumi uusamide bulukwe busiya utanta bwaanda bwamabwe 	16	4945	Female	toi	221212-121357_toi_b9a_elicit_19.wav
mapenzi alike ngaatupa kucita zintu nzyotutayandi 	16	2994	Male	toi	220829-210132_toi_0ae_elicit_39.wav
kuti muye kunyika eyo njaakakonkezya kuli abrahamu akuli izaka akuli jakobo 	16	7804	Female	toi	221230-144601_toi_b9a_elicit_32.wav
kabunga kabasikuvwana kasobana cisobano cakuuma ma kkaadi alimwi kabasola kuyungana kutegwa banyongane mucisobano 	16	10617	Female	toi	221213-112404_toi_b9a_elicit_23.wav
ciewasya nzi kukombelela buumi bwamuntu omwe kuti kakuli obo buumi bukombelelwa buletela 	16	8553	Female	toi	221228-145629_toi_b9a_elicit_47.wav
mwaalumi ulaa muncini wiimvwi amitabi yazyisamu 	16	5671	Female	toi	221205-153008_toi_b9a_elicit_11.wav
amvwe obo wakasamununa zyakusama zyabunabutema bwakwe waliputilila intambala kubusyu bwakwe walyeenyeenya 	16	15881	Male	toi	221011-174142_toi_308_elicit_9.wav
mbwakonzya kuti citamvwungwi kumasamu aamuka mambo 	16	4333	Female	toi	221228-105726_toi_b9a_elicit_0.wav
bantu bobilo basamide zyibaki bali mumuzundano wakuselemuka mucaanda 	16	6624	Female	toi	221230-123721_toi_b9a_elicit_33.wav
cipo cakusisikizya cilalesya bukali makulo aamunkomo alamanya lunyemo lupati 	16	15767	Male	toi	220916-171743_toi_97d_elicit_44.wav
mwana ula masusu aatuba tuba uusamide sikipa yanyanzabili ulikkede mucuuno cizungulukidwe azyuuno zimwi zyanyanzabili 	16	9619	Female	toi	221213-104257_toi_b9a_elicit_3.wav
jehova wakalongezya ing anda yamu egepita nkaambo ka josefa lulongezyo lwajehova lwakalikede ambono zyakwe zyoonse neziba zyamung anda neziba zyamumuunda 	16	17900	Male	toi	221011-174142_toi_308_elicit_40.wav
kozyaanga aminwe yako kozilemba acilembelo camumoyo wako 	16	6080	Female	toi	221213-122458_toi_b9a_elicit_3.wav
basikitanta bobilo basoleka kutanta mulundu uvwumbidwe caanda koonse atala alo beenzinyina mpobabede kubalindila 	16	12455	Female	toi	221205-145546_toi_b9a_elicit_27.wav
mpoonya awo wakaboola esau mukulana wakwe kuzwa mukuvwima 	16	5603	Female	toi	221230-113547_toi_b9a_elicit_45.wav
mwaalumi uujisi magilazi alimwi uusamide sikipa yakucisi caku hawaii ulimvwi munsi munsi amubwa 	16	8780	Female	toi	221212-093944_toi_b9a_elicit_0.wav
nkamu yabantu basamide kabotu ilikkede atebule atusani tutuba kabanwa madilinki akulya zyakulya 	16	9120	Female	toi	221213-093545_toi_b9a_elicit_32.wav
lino angelo wa jehova wakoongolola abrahamu lwabili kuzwa kujulu 	16	5876	Female	toi	221228-201041_toi_b9a_elicit_20.wav
ngooyu mulombwana uukkede mukati mwa n ganda yatilooli alimwi uuseeka seka ku kkamela 	16	11026	Female	toi	221212-151032_toi_b9a_elicit_22.wav
mwaalumi ulasotooka kuzwa mumabwe kunjila mulwizyi kakuli bamwi balangilizya 	16	6965	Female	toi	221212-124432_toi_b9a_elicit_7.wav
banyama bamusyokwe abayuni bamusyokwe cita mbobabede buya balaa kanunko 	16	5762	Female	toi	221214-101722_toi_b9a_elicit_16.wav
mwaalumi mupati ulikkede mpoona ubamba cintu ciboneka mbuli ngowani njasamide naa bbeeke lili munsi lyakwe 	16	10095	Female	toi	221205-204405_toi_b9a_elicit_24.wav
mwaalumi uzuzaana kumbele mukusiyana kakuli bamwi kabacilila kusyule a nkamu yaba sikulangilila 	16	9460	Female	toi	221212-091650_toi_b9a_elicit_8.wav
sa ncobeni tuzoosika mebo abanyoko abakulana bako kukukotama ansi kunembo lyako 	16	14202	Male	toi	221011-170850_toi_308_elicit_9.wav
sena kuli twaambo tumbi tulaa mpemo ziyoya ntoyanda kwaamba 	16	5558	Female	toi	221228-183113_toi_b9a_elicit_7.wav
bauma bbola kunkomwe ya museenga 	16	4605	Female	toi	221213-092248_toi_b9a_elicit_21.wav
mukaintu muna asia usamide mukkame wa nkwiki nkwiki a jansi lya cikambwe ulakulangisisya pearl liboneka cikambwe a sikkaka 	16	9937	Female	toi	221210-143625_toi_b9a_elicit_1.wav
bantu bobilo babikide mitwe yabo atebule kakulinimulombwana uli mu jakete lya cisikili ulanga anze wabona zyendelo zibungene inchinga alimwi anhonda 	16	14338	Female	toi	221207-165029_toi_b9a_elicit_8.wav
wakali kwille kubimba mbuli nzuki zibililizya muzinga wabuci 	16	4287	Female	toi	221228-180049_toi_b9a_elicit_1.wav
ambeyo ndayanda kuli katukkala mukukkomana aluumuno 	16	6125	Female	toi	221228-181007_toi_b9a_elicit_48.wav
bacakolwa basinjuka babba banga ayanda wakusitika anjuka 	16	5422	Male	toi	220829-205441_toi_0ae_elicit_17.wav
wakanywa munggutyu yomwe biyo amane waunka afwooni 	16	7260	Female	toi	221228-162240_toi_b9a_elicit_32.wav
aboobo tandikulek notana ndaambila ncookacitila bobuya 	16	6284	Female	toi	221228-162240_toi_b9a_elicit_19.wav
mwana musimbi uusamide sikipa iisiya acipoompo cacikambwe ulikkede ancinga yamavwili one kumwi kwaanza kwakwe kakujisi acaanza 	16	11706	Female	toi	221205-212020_toi_b9a_elicit_21.wav
mpawo wakatolelela bana bakwe bobile manase a efrai mu elyo jakobo wakalwiidwa kuti 	16	9483	Female	toi	221230-151048_toi_b9a_elicit_10.wav
babwa bobilo aaba bali anze kakuli omwe uli ansi alimwi umwi ulasotooka mumuuya kubweza bbola 	16	7214	Female	toi	221213-112404_toi_b9a_elicit_10.wav
magozwe kunyina naakalikuzumizigwa kuti ape butongoosi nokuba kubuzya mubuzyo uuli woonse kwalikunga kuti naa wabuzya baacisyanyina nkumuuma 	16	13612	Female	toi	221228-190711_toi_b9a_elicit_29.wav
mukaintu ulaamasusu asiya mbi usamide kalembo kakukutaukila kamubala wanyanzabili ausubila wakkala akati kamalubaluba akusambala mumugwagwa wadolopo 	16	14860	Female	toi	221230-122753_toi_b9a_elicit_43.wav
nkabela leya wakati ndajana lukondo nkaambo banakazi bazoondaamba kuti ngusilukondo aboobo wakamuulika izina lya aseri 	16	12047	Female	toi	221229-141356_toi_b9a_elicit_18.wav
lino nibwakaca mupati wakaambila mwanike wakwe kuti bona jilo ndakalede ataata 	16	9483	Female	toi	220929-202615_toi_97d_elicit_2.wav
taakwe uumwaampa uutajisi mulandu 	16	3834	Female	toi	221213-121824_toi_b9a_elicit_23.wav
aboobo ndanywa azyalo inkamele zyanywa mpawo ndamubuzya kuti ino uli mwana wani 	16	8258	Female	toi	221228-203310_toi_b9a_elicit_33.wav
musimbi uusamide campeyo cacisombo alimwi kanyamude bbeke yagwezyo ulangide kutaala kakuli bantu banji kunze kwakwe 	16	8848	Female	toi	221213-103711_toi_b9a_elicit_5.wav
nkabela wakabinga matanga aakwe banyama boonse mbaakavubide 	16	5490	Female	toi	221230-210020_toi_b9a_elicit_34.wav
mwana ulaamasusu mabotu usamide magogo acikambwe asikipa yanyanzabili kumwi ulayaamba mumeenda 	16	7146	Female	toi	221230-121748_toi_b9a_elicit_30.wav
bakati ambweni josefa ulatusula akutuboozezya bubi boonse mbutwakamucitila 	16	6602	Female	toi	221230-144601_toi_b9a_elicit_21.wav
alimwi na wayeeya bubi vumba mulomo wako ajanza nkaambo kusuka malili kulaleta maumba 	16	14928	Male	toi	220916-171743_toi_97d_elicit_29.wav
mudaala chiingabacende wakaamba abuzuba bwamyezi tee kayi eeco caamba kuti kamutaninga unka kukubona 	16	10821	Female	toi	221228-183113_toi_b9a_elicit_14.wav
imuntu muna afulika ulanga mucifwotozya kumwi kasamide bulungu bwiindeneindene amadeekko atondezya zilengwa zyabo naa tunsiyansiya 	16	10980	Female	toi	221230-130419_toi_b9a_elicit_5.wav
mweenzinyoko uuli kufwaafwi mubotu kwiinda munyoko uuli kule songwaala mwanaangu ukondezye moyo wangu 	16	14020	Male	toi	220912-191425_toi_97d_elicit_29.wav
mpawo bantu bakatolelela cipo eco amali aambi mumaanza aabo a benjamini mwanike wabo banyampuka bainka kuegepita baakwiima kubusyu bwa josefa 	16	12387	Female	toi	221230-204223_toi_b9a_elicit_24.wav
eclyo naakaakusika kumbele wakabbukila amunzi wabantu 	16	3108	Male	toi	220825-172540_toi_0ae_elicit_5.wav
ndalota cilota acimwi ndalota kuti izuba amwezi anyenyeezi zili ikumi aimwi zyoonse zyandikotamina 	16	10141	Male	toi	221011-170850_toi_308_elicit_7.wav
lyoonse notuli mulweendo ndotutazyi kabotu nzila yesu mulomo 	16	3743	Male	toi	220829-204606_toi_0ae_elicit_6.wav
wakaavwunga wabikka munkomwi amane waunka haamwaandwe wakajana musankwa 	16	10549	Male	toi	220912-174208_toi_97d_elicit_0.wav
bamakaintu bobilo balikkede amusena nkobaulisya zyakulya zyijikidwe kale kabalanga tulongo longo kutegwa baule cakulya 	16	10504	Female	toi	221212-093156_toi_b9a_elicit_16.wav
mbubo ino ndilateelela kamwale kozumanana odeede lyangu aawo wakazumanana nkombo 	16	10595	Female	toi	221228-125403_toi_b9a_elicit_21.wav
mebo owaangu ulaa mulilo wa leza 	16	3267	Female	toi	221204-133851_toi_ee8_elicit_45.wav
kujulu kuli mubala wa cikambwe bwizu buli mubala wa nyanzabili ku musena wakusobanina cisobano citegwa gold kakuli musimbi ullebelela kwebela kalindi ka bbola 	16	14701	Female	toi	221213-093545_toi_b9a_elicit_12.wav
kana kasankwa kasamide zisani zisalala ulasotoonka atulampolini 	16	6715	Female	toi	221212-092637_toi_b9a_elicit_19.wav
ino kayi nkaambo nzi ng anda yokwanu ncoili mpati kwiinda zimwi alimwi yalo ili akati 	16	9438	Female	toi	221228-093456_toi_b9a_elicit_34.wav
kuli sikuma bbola uimvwi mun ganda sikujata kaimvwi kusyule kwakwe wamwimisya mujulu kajisi gilovu kujanza 	16	10617	Female	toi	221212-091037_toi_b9a_elicit_19.wav
nsezyi naa ndakayuminina kwaciindi cilampa buti nindakasinsimuka ndakajana ndililede iyamagwagwa 	16	15677	Male	toi	220907-201714_toi_97d_elicit_0.wav
tebule iizude zyakulya mitiba mafoloko zipeni munyo alimwi atwakusansila sautu uusiya 	16	10980	Female	toi	221212-131327_toi_b9a_elicit_3.wav
wakajana nceciindi ncotwamana kulalila 	16	3493	Female	toi	221203-121206_toi_ee8_elicit_8.wav
kuli mbuli lino ibbi nanka mweendo uutezemuka mbuli muntu uusamununa cikobela mubuzuba bwampeyo 	16	11752	Female	toi	221214-091851_toi_b9a_elicit_36.wav
lino jakobo wakasika ku luzi ngonguwo beteli munyika ya kanana walo abantu boonse mbaakali abo 	16	12319	Male	toi	221011-163041_toi_308_elicit_7.wav
tende ngulembwe caamba kuti bamwi buzuba mbotazyi 	16	3448	Male	toi	220829-210823_toi_0ae_elicit_22.wav
zibunge kuti balye pele kabatana kulala bantu bamunzi nkokuti bantu ba sodoma boonse 	16	10731	Female	toi	220929-200958_toi_97d_elicit_5.wav
nkubonwa fwulwe a cilimo sunu cakwaangula uzya butezemuka mumugwagwa 	16	10980	Female	toi	221228-151724_toi_b9a_elicit_21.wav
ooyu mudaala chiingabacende wakalaa makumi osanwe aamyaka amyaka yobilo 	16	8008	Female	toi	221228-095833_toi_b9a_elicit_26.wav
mukazi maziba ngomwezi bantu muminzi ya butonga nobanywa mabisi 	16	6329	Female	toi	220828-202103_toi_707_elicit_12.wav
lumwi wakati wence o mwami wangu utakalali dambe komwe buyo ambweni 	16	10254	Female	toi	220927-213329_toi_97d_elicit_45.wav
mubwa ulasotooka mumuuya kaumigwa ameenda 	16	5308	Female	toi	221213-104742_toi_b9a_elicit_24.wav
yavwula myaka yakutabonana yawe ndali kuzimbide biya mbumwaali kuti mpee mu amelika nozisisi zyabalombwana 	16	11752	Female	toi	221228-102126_toi_b9a_elicit_1.wav
sibbuzya takolwi bowa 	16	1520	Male	toi	220829-204606_toi_0ae_elicit_1.wav
uukalalilwa jehova ulawida mulincico bufubafuba bulaangidwe mumoyo wamwana pele musako wakukomya ulabutanda 	16	17991	Male	toi	220916-174104_toi_97d_elicit_24.wav
nkabela farao wakaambila balanda bakwe kuti sa cilakonzeka kujana muntu aumwi uli mbuli oyu uuli a muuya wa leza 	16	11979	Male	toi	221011-181531_toi_308_elicit_33.wav
katuya ndilakweenzya kukamvwu kasubila lwando ulalindila 	16	5989	Female	toi	221228-190711_toi_b9a_elicit_5.wav
kunjila mucilao mwakabede sara wati fwambaana ubambe insangwa zyotatwe zyabusu 	16	10232	Female	toi	220927-213329_toi_97d_elicit_4.wav
nitwakapiluka twakainda amunzi wabantu 	16	2178	Male	toi	220825-174423_toi_0ae_elicit_26.wav
