sentence	BitsPerSample	durationMsec	speaker_gender	mother_tongue	audio
nkabela wakaambila balanda bakwe kuti amuzulule kunembo lyangu alimwi amutalamukane itanga limwi atanganyina 	16	6511	Male	toi	221011-153723_toi_308_elicit_16.wav
tunji tunji inga waakupiluka nolilampa nokuba kuti inga wazya wacembaala kale tacikwe mulimo 	16	7713	Male	toi	220829-113431_toi_0ae_elicit_29.wav
nkabela jakobo wakasika kabotu kumuni wa sekemu munyika yakanana naakazwa ku padanaramu wakayaka zilao zyakwe kunembo lyamunzi 	16	20872	Male	toi	221011-160540_toi_308_elicit_9.wav
kulibombya akuyoowa jehova kulaleta buvubi abulemu abuumi 	16	11956	Male	toi	220916-174104_toi_97d_elicit_14.wav
utavuwi mufubafuba mbuli bufubafuba bwakwe kuti uteelani awe ayebo vuwa mufubafuba mbuli bufubafuba bwakwe 	16	15132	Male	toi	220916-183449_toi_97d_elicit_42.wav
nyampuka uye ku beteli ukale nkuko uyake cipaililo ca leza oyo nguwenya iwakalibonya kulinduwe ciindi eciya nowakacija kubusyu bwa esau mukulana wako 	16	24661	Male	toi	221011-163041_toi_308_elicit_2.wav
munkomwi yajekete wakazwisya katobolo akasando kakwe akuzibikka kunsi aabbuku atebule kulembela 	16	14633	Male	toi	220912-174208_toi_97d_elicit_5.wav
uya kuleka iwakwe naimvwide nzala 	16	2246	Male	toi	220824-212101_toi_0ae_elicit_30.wav
koya kumunzi ukeete cisuwo 	16	1860	Male	toi	220829-121443_toi_0ae_elicit_12.wav
waakuswaya umwi muntu waku adulamu izina lyakwe kali hira 	16	7781	Male	toi	221011-170850_toi_308_elicit_43.wav
walyaanga akatambo kasalala pyu wati ngooyu mutaanzi kuzyalwa 	16	9392	Male	toi	221011-174142_toi_308_elicit_30.wav
alimwi kuti muntu nayanda kukwata nguni uutalik makani 	16	2790	Male	toi	220825-180654_toi_0ae_elicit_34.wav
umwi musankwa katana anzyigwa amakwaakwe 	16	2563	Male	toi	220829-205441_toi_0ae_elicit_20.wav
utasukami zilyo zyakwe zilweela nkaambo nzilyo zyalweeno utalikataazyi kuti ube muvubi 	16	15450	Male	toi	220916-174104_toi_97d_elicit_37.wav
lyoonse mabondo alacaala kaabwa 	16	2246	Male	toi	220829-115108_toi_0ae_elicit_1.wav
nokuba kuti yakamanide kale wakali kupala 	16	2563	Male	toi	220829-210823_toi_0ae_elicit_33.wav
bakabaambila kuti tatukonzyi kucita obo pe tatukonzyi kupa mucizi wesu kuti akwatwe kumwaalumi uutapalwidwe nkaambo kucita obo kulatuusya bweeme 	16	17741	Male	toi	221011-160540_toi_308_elicit_28.wav
nobakabuzigwa kuti muzwa kuli bakaamba kuti 	16	3153	Male	toi	220829-210132_toi_0ae_elicit_47.wav
mbuboobo mbwaakaulikwa izina lya israyeli alimwi leza wakamwaambila kuti 	16	6874	Male	toi	221011-163041_toi_308_elicit_13.wav
cimbo cipati caali kusobanwa kaindi ncinande 	16	4356	Male	toi	220829-113431_toi_0ae_elicit_41.wav
mumasi aa butonga amwi kuleka cizyanwa kubuwe kulike 	16	4787	Male	toi	220829-123454_toi_0ae_elicit_16.wav
kusisa makani nkokulemeka leza pele kuyubununa makani nkokulemeka bantu 	16	9891	Male	toi	220916-181440_toi_97d_elicit_14.wav
mbwaakasikilankokakala wakakaita 	16	2291	Male	toi	220829-121443_toi_0ae_elicit_37.wav
cakunyangana citola uya uunyangauka 	16	2314	Male	toi	220829-210823_toi_0ae_elicit_46.wav
ono sunu antela kaambyo takaambi mwanaa nya 	16	2767	Male	toi	220829-113431_toi_0ae_elicit_16.wav
wakati ncobeni njooselukila mukabanda mwaabede mwanaangu cakulila mbuboobo wisi mbwaakamulila 	16	12024	Male	toi	221011-170850_toi_308_elicit_40.wav
musa nkwa wakati eelyo mulandu wamyakaamyaka asunu nseciseswa 	16	4832	Male	toi	220829-115108_toi_0ae_elicit_36.wav
aawa ndati inga ndakkomana kuti mwaboola kwangu kwainda biyo cisela cawoola mulandijana 	16	11729	Male	toi	220912-165131_toi_97d_elicit_1.wav
kabe kaindi awalo musimbi waakwatwa kumbi 	16	2495	Male	toi	220829-115108_toi_0ae_elicit_32.wav
bona myaka iili makumi obile ndakakala kulinduwe imbelele zyako ampongo zyako tazikwe nizyakasowa 	16	14860	Male	toi	221011-123458_toi_308_elicit_14.wav
amulanda musimbi uulya izina lyanamalelo wakwe nkozili zintu zyone ansi nziniini 	16	13725	Male	toi	220916-171743_toi_97d_elicit_22.wav
ceo taci kooyooyeeyegwa limbi munyika nkaambo kanzala iiyoosyaalila nkaambo iyoobija loko 	16	10322	Male	toi	221011-181531_toi_308_elicit_26.wav
twakalota ziloto toonse tobile mubusiku bomwe umwi aumwi wakalota ciloto cipandululwa bumbi 	16	10980	Male	toi	221011-181531_toi_308_elicit_3.wav
pesi sunu tujana kuti budima bwakafwa 	16	2563	Male	toi	220829-123454_toi_0ae_elicit_12.wav
wakakaka mupulisa kumwi kalanga mpotomona inga waaleta mali ku opesi yabweende bwamumigwagwa 	16	16493	Male	toi	220912-171124_toi_97d_elicit_42.wav
awabili awatatu abasimatanga bakali musule boonse buyo wakabalailila kuti mbuboobu mbumweelede kwaambila esau mwamujana 	16	12636	Male	toi	221011-153723_toi_308_elicit_19.wav
bakatola umwi aumwi ipanga lyakwe boongomokela munzi bajaya baalumi boonse 	16	10980	Male	toi	221011-160540_toi_308_elicit_43.wav
ku buluwayo kucitijilo cabasankwa 	16	2178	Male	toi	220829-115108_toi_0ae_elicit_28.wav
ono bumwi buzuba nduwe ooya kuba mweendo 	16	2745	Male	toi	220829-210823_toi_0ae_elicit_20.wav
ambeyo kaambo aka ndaali kukayeeya lyoonse sunu nkabela wakaunka 	16	5218	Male	toi	220829-121443_toi_0ae_elicit_36.wav
azisyu zyakuzilundu zyacelwa tubelele tulakupa zyakusama ampongo zilaleta muulo wamuunda 	16	2881	Male	toi	220912-191425_toi_97d_elicit_42.wav
nkabela muuya wakwe nowakaamba kumusia nkaambo wakafwa wakamuulika izina lya benoni pele wisi wakamuulika izina lya benjamini 	16	19874	Male	toi	221011-163041_toi_308_elicit_23.wav
basike farao wakabalwiida ciloto cakwe pele katakwe naba omwe iwakakonzya kucipandulula 	16	13635	Male	toi	221011-181531_toi_308_elicit_0.wav
kwiinda oyo uubombeka bombeka alulimi lwakwe kufumbwa uubbida wisi abanyina 	16	12205	Male	toi	220916-164149_toi_97d_elicit_17.wav
ciindi eciya farao naakakalalila balanda bakwe akutwaanga muntolongo mung anda yasilutwe wabatabilizi mebo amupati wabajisi 	16	19261	Male	toi	221011-181531_toi_308_elicit_2.wav
walo kuti kazyi kuti ngowaabisya unakwiide kuumunye akulindila nduwe 	16	5218	Male	toi	220825-180654_toi_0ae_elicit_24.wav
elyo esau wakabuzya kuti nkokutyeni aya makamu makamu ngendakaswana wakavuwa kuti nkokujana buuya mumeso aamwami wangu 	16	16471	Male	toi	221011-153723_toi_308_elicit_47.wav
tiikwakainda aciindi cilamfwu alimwi kwakalimvwisya jwi lyamuntu ndime dakuungila nendikanana okuno 	16	16493	Male	toi	220912-160501_toi_97d_elicit_37.wav
kunjila mumapenzi aatapasulukiki 	16	2359	Male	toi	220825-172540_toi_0ae_elicit_39.wav
kujana kacelo kaligwa uya kuti pe ootu ntolele twana twangu kumunzi 	16	5308	Male	toi	220824-212101_toi_0ae_elicit_29.wav
ndaamba nduwe lwando wakavwiila haamwaandwe cakurwenyuka nduwe cinyama ooinda kubija kuzinyama 	16	13521	Male	toi	220907-203915_toi_97d_elicit_38.wav
wesu bakali kusambala nswi 	16	1724	Male	toi	220829-210132_toi_0ae_elicit_46.wav
elyo mukweenda kwabo buyoofu buzwa kuli leza bwakajata minzi iyakeengelede aboobo teebakatobela bana ba jakobo 	16	16788	Male	toi	221011-163041_toi_308_elicit_6.wav
pesi kufumbwa ncaacita baamba zina lyausyi ategwa mulange mwanaa ndaba 	16	7645	Male	toi	220824-212101_toi_0ae_elicit_15.wav
akukasibika kuti bazikufume kulisya bana buntu 	16	2881	Male	toi	220829-121443_toi_0ae_elicit_44.wav
cakwaamba kuti ma ngwani jehova alimwi ntapengi mubucete akubba 	16	9415	Male	toi	220916-171743_toi_97d_elicit_7.wav
wakamubuzya kuti nduweni izina lyako wakati ndime jakobo 	16	9574	Male	toi	221011-153723_toi_308_elicit_30.wav
lino kusule lyazeezyo mwakazwa impwizi azimwi zili musanu azibili zikotede zili aziwa zibi ziyuminide loko amibili yazyo 	16	6624	Male	toi	221011-181531_toi_308_elicit_12.wav
tee babwa mbabatasali banga kufwumbwa banyina walo nkutanta 	16	6216	Male	toi	220907-203915_toi_97d_elicit_43.wav
nkujana kunyina aciliko oonse musinza kukwa bakalu 	16	4446	Male	toi	220829-121443_toi_0ae_elicit_46.wav
koza nkutume kulimbabo wakavuwa kuti ndaya wakamwaambila kuti mbubo koya 	16	9120	Male	toi	221011-170850_toi_308_elicit_13.wav
amulilo uutakuti liso lisampaula wisi litalemeki banyina liyoononkolwa kulibacikwangala bakukalonga 	16	20668	Male	toi	220916-171743_toi_97d_elicit_16.wav
kowakaciyandawida niciba cakabbigwa isikati niciba cakabbigwa masiku 	16	11230	Male	toi	221011-123458_toi_308_elicit_17.wav
jehova nguumunikila meso aaboonse buyo mwami uubeteka batengwana cakululama 	16	12364	Male	toi	220916-164149_toi_97d_elicit_34.wav
pele bakulana bakwe nebakabona kuti wisi ulamuyandisya kwiinda beenzinyina bakamusula kabataamba caluumuno kulinguwe 	16	15495	Male	toi	221011-170850_toi_308_elicit_0.wav
nibakajoka kuzyila kukulunduka nindakajalula ndakajana kwiimvwi bobilo 	16	9097	Male	toi	220907-201714_toi_97d_elicit_9.wav
naakatalika kulailila mutelampondo haamwaandwe kumwi kalanga acipepa cakali kulemba mweenzyina 	16	12954	Male	toi	220912-160501_toi_97d_elicit_45.wav
kukupandulwida kambyaaka ndakwaambila kamwi kaano 	16	2972	Male	toi	220825-174423_toi_0ae_elicit_23.wav
bumwi buzuba twakaya musyokwe kukuvwira 	16	2790	Male	toi	220825-174423_toi_0ae_elicit_24.wav
myaka iili makumi obile ndakali kulinduwe ndakakubelekela milimo myaka iili ikumi aine 	16	13317	Male	toi	221011-123458_toi_308_elicit_19.wav
mbuli muntu uuanga ibbwe munkwilipo mbwabede uupa mufubafuba bulemu 	16	12160	Male	toi	220912-191425_toi_97d_elicit_2.wav
kunyina mupulisa utikandijate ndazwa waano nkaambo takukabi haamwaandwe wakuti bajate 	16	13589	Male	toi	220912-160501_toi_97d_elicit_14.wav
pele baluleme bayoobona buwe bwabo koma mwana wako elyo uyookupa lulyokezyo 	16	14134	Male	toi	220916-164149_toi_97d_elicit_37.wav
elyo izaka wakazanga wafwa wainka kulibasinsiku bakwe naakacembaala bucembele buzwide nkabela esau a jakobo bana bakwe bakamuzika 	16	20781	Male	toi	221011-163041_toi_308_elicit_34.wav
kuli beelela guwo kubbubbula 	16	1746	Male	toi	220825-174423_toi_0ae_elicit_8.wav
wakali kulibambila kulanga babwa kuti naa babuka aboobo wakalicizyi cindi nibakasika 	16	10844	Male	toi	220907-201714_toi_97d_elicit_15.wav
mbuboobo mbwaakamubika kuti aendelezye nyika yoonse ya egepita 	16	5944	Male	toi	221011-181531_toi_308_elicit_40.wav
pele onani wakaziba kuti lunyungu talukooyooba lwakwe aboobo naakaswanaana amukamukulana wakwe wakasowela anyika kuti atapi mukulana wakwe lunyungu 	16	16017	Male	toi	221011-174142_toi_308_elicit_1.wav
amane waluba wide kuti ambeyo ndaluba ani mebo kali mumoyo 	16	4514	Male	toi	220825-174423_toi_0ae_elicit_7.wav
nkokuti ncilengwa cibi 	16	1678	Male	toi	220829-113431_toi_0ae_elicit_40.wav
alo kuti uumukwete kali wakantya inga mukaintu wacimvwa kulombozegwa 	16	5104	Male	toi	220829-123454_toi_0ae_elicit_48.wav
ncotuti vuna silumamba sinzala utunda cibi 	16	2745	Male	toi	220829-123253_toi_0ae_elicit_3.wav
muli amulandu wakwiindilizya kubalisya mootokala wakaamba mupulisa 	16	9324	Male	toi	220912-165131_toi_97d_elicit_33.wav
ndiyanda kukujaya nkaambo kakunyonganya kumisya akujaya caalama 	16	10005	Male	toi	220912-160501_toi_97d_elicit_6.wav
alimwi atutangane buzwalani bwalukwatano kuti mutupe bana banu basimbi anywebo mutole bana besu basimbi 	16	14179	Male	toi	221011-160540_toi_308_elicit_23.wav
ciindi coonse sizibi uleemuzya pele mululami ula pa takasyi pe 	16	13612	Male	toi	220916-174104_toi_97d_elicit_5.wav
ndiya kukujana kukavwu kasubila wakajokezya ntobolo yakwe ansando munkomwi yamukati aajekete 	16	14293	Male	toi	220912-165131_toi_97d_elicit_13.wav
nkabela abo basankwa bakabijilwa akukalala loko nkaambo kabufubafuba obo 	16	10935	Male	toi	221011-160540_toi_308_elicit_20.wav
mbuboobo jakobo mbwaakaulika oko kuntu leza nkwaakaambaula awe izina lya beteli 	16	13113	Male	toi	221011-163041_toi_308_elicit_19.wav
josefa mbwaakaba muzike mucisi ca egepita lino jakobo kakede munyika yabweenzu bwabamawisi 	16	12886	Male	toi	221011-163041_toi_308_elicit_46.wav
oyo muntu nafwa kufumbwa bantu babona mwana bayeeya usyi 	16	4764	Male	toi	220824-212101_toi_0ae_elicit_13.wav
wakasamide acibaki cituba atayi uusiya munsingo 	16	7895	Male	toi	220912-174208_toi_97d_elicit_31.wav
gwayi wabuka haamwaandwe wakaanzya lwando lumwemwe kumakosi amane wakazumanana 	16	10958	Male	toi	220907-203915_toi_97d_elicit_15.wav
mulonga nouba munzi wabantu mpaakali kukonzya kujana meenda 	16	3539	Male	toi	220825-172540_toi_0ae_elicit_4.wav
mbuli ikoma mbolizumuka mbwabede mutolo abulo bwakwe mutolo ulanjizya ijanza lyakwe mumbede 	16	17809	Male	toi	220912-191425_toi_97d_elicit_8.wav
mulaleta anywebo mwati ninswi exi tee mamvwa alo ninkamu zyakulikamuzya 	16	5581	Male	toi	220829-210823_toi_0ae_elicit_0.wav
kamboni sikubeja ulanyonyooka pele majwi aamuntu uuswiilila alakalilila 	16	12342	Male	toi	220916-174104_toi_97d_elicit_7.wav
aboobo cipo cakatumwa kunembo pele walo mwini wakoona masiku ayo mpoonya awo amalabba 	16	3471	Male	toi	221011-153723_toi_308_elicit_22.wav
ndakamusyambila kakaya kaambo kakaindi nkaakandisyola munsaa banyina 	16	4945	Male	toi	220825-174423_toi_0ae_elicit_6.wav
wakaangula buluke busiya jekete lisiya amasookesi aasiya mabbusu aalo akali kusiya 	16	8848	Male	toi	220907-201714_toi_97d_elicit_40.wav
nindakoona amusimbi umbi nkaambo kaluyando naundakajisi kuli caalama inga mwayeeya bio mbundakalimywa 	16	11366	Male	toi	220912-174208_toi_97d_elicit_18.wav
babungike zilyo zyoonse zyamyaka eyi mibotu iiti sike balondole maila mumaanza aa farao kuti kube zilyo muminzi babike kumbali 	16	11956	Male	toi	221011-181531_toi_308_elicit_30.wav
pesi ndakonaya kukugwasya munzila imwi nkaambo mvwide kuti kuli nzala nkali mucisi 	16	6443	Male	toi	220829-121443_toi_0ae_elicit_10.wav
wamvwa sena mbocaamba ino ambotukabelesya kaambyo aka 	16	3924	Male	toi	220825-174423_toi_0ae_elicit_4.wav
ing ombe zili musanu azibili zibotu nkukuti myaka iili musanu aibili aalo makunka aali musanu aabili nkukuti myaka iili musanu aibili nkaambo ciloto ncimwi buyo 	16	19579	Male	toi	221011-181531_toi_308_elicit_20.wav
uvuwe majwi aalusinizyo kulibaabo bakutuma utabbidi mucete nkaambo mutengwana nekuba kuuma bapengede mumulyango 	16	20328	Male	toi	220916-174104_toi_97d_elicit_30.wav
ngotazyi kabotu pe cimwi cindi uya kukwata utondwa 	16	3743	Male	toi	220829-204606_toi_0ae_elicit_12.wav
nkabela mukuzyala kwakwe umwi mwana wakazuluzya ijanza lyakwe lino sikutumbusya wakajata ijanza lyakwe 	16	11684	Male	toi	221011-174142_toi_308_elicit_29.wav
wakali kumubelekela ulabamba bamba mung anda ijikila wakamwaambila 	16	8802	Male	toi	220912-174208_toi_97d_elicit_1.wav
kucintu neciba comwe mung anda zyoonse buyo nzyaajisi wazyaaba mumaanza aangu 	16	8485	Male	toi	221011-174142_toi_308_elicit_45.wav
wabona kuti esau uleza abantu bali myanda yone abone obo wakapambukanya bana a leya a rakele abalanda basimbi bobile 	16	6715	Male	toi	221011-153723_toi_308_elicit_39.wav
mwanaa nsya ufwida kucizyalilo 	16	2064	Male	toi	220829-113431_toi_0ae_elicit_8.wav
mpawo bakapa jakobo baleza beenzu boonse ibakali mumaanza aabo amacoco aamumatwi aabo nkabela jakobo wakazisisa kunsi lyamubanga waku sekemu 	16	21621	Male	toi	221011-163041_toi_308_elicit_5.wav
nkabela juda wakajanina eri mwanaakwe mutaanzi mwanakazi izina lyakwe kali tamara 	16	11661	Male	toi	221011-170850_toi_308_elicit_48.wav
nkaambo tatuzyi kabotu lyoonse mbotuteende 	16	2699	Male	toi	220825-180654_toi_0ae_elicit_8.wav
cilaambwa kuti ulatuka buyo mbuli mandomondomo mubuzuba bwamvula mbwabede mwanakazi sikukazyanya 	16	16629	Male	toi	220912-191425_toi_97d_elicit_33.wav
esau wasika kukoka lyomwe akulilwisya ikoka lisyeede liyoofutuka 	16	10300	Male	toi	221011-153723_toi_308_elicit_3.wav
wakabalisya mootokala kutegwa akajanike walibambila natana sika kwakwe mutelampondo 	16	12183	Male	toi	220912-165131_toi_97d_elicit_20.wav
mufubafuba ulabwanta akuseka buyo taakwe luumuno basikujaya bantu balasula uululeme 	16	13385	Male	toi	220916-164149_toi_97d_elicit_30.wav
nkabela sekemu mwana wa hamori mu hiti mwami wacisi naakamubona wakamutizya woona awe wamubisizya 	16	18694	Male	toi	221011-160540_toi_308_elicit_13.wav
mpawo wakabamba cikobela cakwe kulinguwe mane simalelo wakwe asike kung anda 	16	8371	Male	toi	221011-180320_toi_308_elicit_3.wav
nkabela israyeli wakaambila josefa kuti bona sa bakulana bako tabali mukweembela ku sekemu 	16	10844	Male	toi	221011-170850_toi_308_elicit_12.wav
inkamele zinyonsya zili makumi otatwe abana bazyo impwizi zili makumi one abacende bali ikumi imbongolo impwizi zili makumi obile ambongolo incende zili ikumi 	16	8326	Male	toi	221011-153723_toi_308_elicit_14.wav
muntu oonse nakede kabotu ulatobela malamuno ponse 	16	4424	Male	toi	220829-210132_toi_0ae_elicit_35.wav
bubo sena kamulindila ndibaite wakaamba muntu wakali kukanana 	16	9211	Male	toi	220912-160501_toi_97d_elicit_36.wav
pesi nabindide antela napengede tasali pe 	16	3584	Male	toi	220829-210132_toi_0ae_elicit_36.wav
pele basongo balalesya bukali na musongo ulakazyanya amufubafuba 	16	9801	Male	toi	220916-164149_toi_97d_elicit_29.wav
nkokuti munyika ya kanana ngaaya makani aamazyalani aa jakobo josefa naakajisi myaka iili ikumi amusani aibili wakali kweembela imbelele abakulana bakwe 	16	15155	Male	toi	221011-163041_toi_308_elicit_47.wav
pele na banyonyooka baluleme balavula muntu uucenjezegwa nekubaboobo uciyumya moyo wakwe 	16	15745	Male	toi	220916-164149_toi_97d_elicit_22.wav
ndalomba kuti mundilekelele kunzila njindabelesya kubamba kaambo aka 	16	9029	Male	toi	220912-174208_toi_97d_elicit_7.wav
waakuba amwana ayebo buya kukumanina 	16	2835	Male	toi	220824-212101_toi_0ae_elicit_35.wav
uuvuzya imbono zyakwe kukujana impindu zyazikwelete ulaziyobweda sikufwida bacete luzyalo 	16	14883	Male	toi	220916-164149_toi_97d_elicit_1.wav
abana ba biliha mulanda musimbi wa rakele mbaaba dani a nafitali 	16	9324	Male	toi	221011-163041_toi_308_elicit_30.wav
elyo nobaseswa baya balimbwa mulandu 	16	2563	Male	toi	220825-174423_toi_0ae_elicit_14.wav
kuti oolanga inga wati ndajana aali bantu ncobeni ani ncigwebenga 	16	8984	Male	toi	220912-174208_toi_97d_elicit_33.wav
sena ncibotu omweenzu mboounkila kumasaa bantu 	16	2972	Male	toi	220829-204606_toi_0ae_elicit_4.wav
wence kondivuna kuzwa kumaanza aamukulana wangu kuzwa kumaanza aa esau nkaambo ndamuyoowa 	16	3471	Male	toi	221011-153723_toi_308_elicit_8.wav
mbwaakasikila wakaita bakaintu bakwe kuti bamupe cibwantu 	16	3130	Male	toi	220825-174423_toi_0ae_elicit_40.wav
nekuba kweenda amuntu silunyemo kuti utaiyi inzila zyakwe akulyaanga mukakole 	16	18081	Male	toi	220916-174104_toi_97d_elicit_32.wav
israyeli kayandisya josefa kwiinda bana bakwe boonse nkaambo kali mwana wabucembele bwakwe nkabela wakamucitila ijansi lili amaboko 	16	16108	Male	toi	221011-163041_toi_308_elicit_49.wav
antela musankwa uubba naba musimbi ulaa maafwa 	16	3584	Male	toi	220829-204606_toi_0ae_elicit_13.wav
mbeba ntumbu tiinonzyi bula 	16	2790	Male	toi	220824-212101_toi_0ae_elicit_21.wav
kali mulombe antoomwe abana ba biliha abana bazilipa banakazi bawisi nkabela josefa wakaletela wisi makani aabo mabi 	16	14247	Male	toi	221011-163041_toi_308_elicit_48.wav
mpawo mupati wabakutausi wakaambila farao kuti sunu ndaibaluka kubisya kwangu 	16	9982	Male	toi	221011-181531_toi_308_elicit_1.wav
haamwaandwe wakamubona mupulisa oyu mukamboni mboni kamootokala 	16	10118	Male	toi	220912-165131_toi_97d_elicit_30.wav
akucenjeka kutwi kwako kumajwi aaluzibo utakaki kukoma mwana na wamuuma amusako takoofwa pe 	16	16834	Male	toi	220916-174104_toi_97d_elicit_44.wav
alimwi lwatatu wakazyala mwana mulombe wamuulika izina lya sela kali ku kezibi naakamuzyala 	16	10095	Male	toi	221011-170850_toi_308_elicit_47.wav
kuti kubukoko mwalwana amweenzinyoko umwi 	16	2200	Male	toi	220825-180654_toi_0ae_elicit_20.wav
ndaamulimo aboobo utandicelesyi ndiyanda kubeleka mupulisa wakalanga haamwaandwe cakunyandwa amane wakati mbubo 	16	16289	Male	toi	220912-171124_toi_97d_elicit_38.wav
lino farao wakaambila josefa kuti muciloto cangu ndakaliimvwi ankomwe yalwizi 	16	7033	Male	toi	221011-181531_toi_308_elicit_10.wav
sena tee ncuulu comwe biyo cakacaala inzya nkwaali mbubo kondilangila ndaboola 	16	13884	Male	toi	220912-165131_toi_97d_elicit_3.wav
lino bana ba jakobo bakali ikumi ababili twenty three bana ba leya mbaaba rubeni mwana mutaanzi wa jakobo 	16	14633	Male	toi	221011-163041_toi_308_elicit_29.wav
amucileke eco balombwana tamuna penga pe 	16	2722	Male	toi	220829-210132_toi_0ae_elicit_33.wav
ati wasika ino musankwa sena toyeeyede kaambo nkookasiya 	16	3993	Male	toi	220829-115108_toi_0ae_elicit_35.wav
makwaakwe pesi bukoko tibwakali munanda yamakwaakwe pe bwakali biyo mumbi munanda 	16	6511	Male	toi	220829-205441_toi_0ae_elicit_22.wav
eci nkaambo kakuyandana kapati ulajana mubasimbi mbatayandi tasiki pe 	16	5558	Male	toi	220824-212101_toi_0ae_elicit_0.wav
yaa nkumutambula biyo bakaintu mpamunya nkukajwa 	16	4083	Male	toi	220829-121443_toi_0ae_elicit_43.wav
ulati bakanduuma pele teendakaciswa bakandiyasa pele teendakamvwa nsinsimuke lili nkayandaule cakunywa alimwi 	16	18944	Male	toi	220916-181440_toi_97d_elicit_11.wav
mubelesi wa lwando wakaambila haamwaandwe kuti mweenzyina wakali kubala kuzyuli ndyaakali kubalila mazuba woonse 	16	16561	Male	toi	220907-203915_toi_97d_elicit_8.wav
lwando wakabona kuti awa taku ziluzi kumeso kokwa haamwaandwe kwaamutondezya 	16	11752	Male	toi	220912-160501_toi_97d_elicit_19.wav
kunyina cizyano cikondelezya mbuli budima 	16	2563	Male	toi	220829-123454_toi_0ae_elicit_18.wav
ncotwaamba kuti nyeele mpya ibambula mulomo 	16	2926	Male	toi	220829-123454_toi_0ae_elicit_21.wav
uso abanyoko basekelele lwakakuzyala akondwe mwanaangu undipe moyo wako meso aako alange inzila zyangu 	16	18036	Male	toi	220916-181440_toi_97d_elicit_3.wav
uli munyama aboobo bantu balaa myoyo yabunyama mbuki nduwe tabeelede kupona atalaanyika 	16	16357	Male	toi	220912-160501_toi_97d_elicit_3.wav
moonse buu ulati kunyina cakasyangidwe 	16	2246	Male	toi	220829-121443_toi_0ae_elicit_49.wav
kumvwa ulamvwa pele tabiki moyo kumakani sa ulibwene muntu uufwanzya kwaamba 	16	13521	Male	toi	220916-164149_toi_97d_elicit_40.wav
pele na mwakaka kutuswiilila na mwakaka kupalulwa tulatola buyo mwana musimbi wesu twiinke 	16	11865	Male	toi	221011-160540_toi_308_elicit_31.wav
nkaambo ncibotu kwaambilwa kuti swena okuno kwiinda kufwinsigwa kumeso aamweendelezi 	16	14225	Male	toi	220916-181440_toi_97d_elicit_18.wav
wakaavwunga wabikka munkomwi amane waunka haamwaandwe wakajana musankwa 	16	10549	Male	toi	220912-174208_toi_97d_elicit_0.wav
loololesya sokwe wakautyola mucila 	16	2495	Male	toi	220829-210823_toi_0ae_elicit_24.wav
buncelele bula ambeyo mbwindakabede 	16	2972	Male	toi	220824-212101_toi_0ae_elicit_36.wav
wakaminta alimwi wazyala mwana mulombe wamuulika izina lya onani 	16	7486	Male	toi	221011-170850_toi_308_elicit_46.wav
alimwi bagutu bamatanga aako nsikwe nindakabalya kufumbwa cintu icakalumwa banyama bamusokwe 	16	7169	Male	toi	221011-123458_toi_308_elicit_15.wav
bamapulisa cino cindi balomba banabuleya kuti bagwasye mumulimo wakuyandaula zigwebenga ezyi 	16	11207	Male	toi	220907-201714_toi_97d_elicit_29.wav
na mwazumina obo tulamupa bana besu basimbi akukwata bana banu basimbi alimwi tulakala antoomwe tube musyobo omwe 	16	14973	Male	toi	221011-160540_toi_308_elicit_30.wav
batatangali kabotu muli zimwi zimbo nokuba kuti 	16	3176	Male	toi	220829-113431_toi_0ae_elicit_48.wav
busyu usyonkede muzyiba lyabulowa acamba moyo wakalekede kale kuduntaana 	16	13362	Male	toi	220907-201714_toi_97d_elicit_3.wav
mpawo juda wakaambila onani kuti unjilile mwanakazi wamukulana wako ucite mbweelede mulamu wako ukabusizye mukulana wako lunyungu 	16	16335	Male	toi	221011-174142_toi_308_elicit_0.wav
cuuno cabwami bwakwe ciyooima nji musako akutapatila zilaleta busongo 	16	12432	Male	toi	220916-164149_toi_97d_elicit_35.wav
cikulukulu nenanda 	16	1111	Male	toi	220829-113143_toi_0ae_elicit_43.wav
kunyina muntu uuleta caali mulandu cita zyinya lilike 	16	3584	Male	toi	220829-115108_toi_0ae_elicit_21.wav
nitwakali kunywa bukoko amwi amunzi kwakainda 	16	4038	Male	toi	220829-123454_toi_0ae_elicit_35.wav
aawo mugwagwa wakausa kapati akubbwilimana anga watilamabele 	16	4605	Male	toi	220829-210823_toi_0ae_elicit_36.wav
ucimvwa kuti musimbi ngookatizyizye sunu waakwatwa awalo nkuzya kumunzi mbwaakasikila biyo 	16	8054	Male	toi	220829-115108_toi_0ae_elicit_33.wav
mamvwa atukole zyoonse mozili munzila yabapilingene pele uulibamba kabotu uli kule kulinzizyo 	16	14701	Male	toi	220916-174104_toi_97d_elicit_15.wav
mpawo josefa wakaambila farao kuti ciloto ca farao ncimwi buyo leza watondezya farao ncayoocita 	16	8326	Male	toi	221011-181531_toi_308_elicit_19.wav
alimwi ing ombe zili musanu azibili zikotede zibi izyakasyaalila kuzwa nkukuti myaka iili musanu aibili 	16	13408	Male	toi	221011-181531_toi_308_elicit_21.wav
mbasilisi babanyama baamunzi twakaile kuzyibila biya sunu kayi mpotulida 	16	12137	Male	toi	220912-174208_toi_97d_elicit_39.wav
ncocili cibi kwaamba kuti nselyi nkuyu nja kesu 	16	3811	Male	toi	220825-174423_toi_0ae_elicit_46.wav
pesi balaa munzi bakabona kuti awalo iwakwe nyina wakalimvwide nyota 	16	4038	Male	toi	220825-172540_toi_0ae_elicit_13.wav
ijanza lyakwe nanka kuulu kwakwe munyika yoonse ya egepita cita wazumina yebo 	16	6647	Male	toi	221011-181531_toi_308_elicit_42.wav
kukazika moyo nkoongelezya mweendelezi lulimi iutete lulabombya zifuwa 	16	10663	Male	toi	220916-181440_toi_97d_elicit_27.wav
pele kuli jehova muntu nkwajana lubeta lubotu muntu uupilingene ulasesemya baluleme 	16	12773	Male	toi	220916-164149_toi_97d_elicit_47.wav
mbombede inkasaalo yakali kundikola isikati ampeyo masiku nkabela ng onzi zyakacija kumeso aangu 	16	11661	Male	toi	221011-123458_toi_308_elicit_18.wav
inzya yawe mulimo wako uluuzyi wakaamba haamwaandwe kumwi kaseka seka 	16	9369	Male	toi	220912-174208_toi_97d_elicit_44.wav
tukala kumbo kubweengwa 	16	1406	Male	toi	220829-210132_toi_0ae_elicit_48.wav
amvwe obo wakasamununa zyakusama zyabunabutema bwakwe waliputilila intambala kubusyu bwakwe walyeenyeenya 	16	15881	Male	toi	221011-174142_toi_308_elicit_9.wav
sena tonababona bapati nobanga azyila musyokwe doono 	16	6193	Male	toi	220824-212101_toi_0ae_elicit_26.wav
